postulante_id,pregunta_id,respuesta_id,texto.respuesta,nota
1516970.0,37.0,296251.0,"para llegar a los clientes que apuntamos divergen dos canales, para aquellos que poseen una empresa más pequeña las redes sociales son una potente forma de publicidad, mostrar proyectos anteriores que se acomoden a sus necesidades y puedan encontrar atractivos es la principal forma de captarlos en esos medios. mientras, las empresas mas grandes o clientes con cultivos responden mejor a las reuniones formales con un pitch estudiado que muestre resultados directos de trabajos o el estudio a través de una página web y correo formal.",7.0
8844090.0,37.0,1830509.0,"venta directa, con catálogos y publicidad en imágenes, es rentable ya que la producción va directamente con la venta, producto vendido, producto que de fabrica. mas aya de llegar a un cliente final, nuestro segmento apunta al intermedio, para así lograr mas rentabilidad y atacar la mayor cantidad de clientes.",3.0
12272310.0,37.0,1482588.0,"web
rrss
teléfono
correo 
las redes sociales  y teléfono me funcionan  super bien para mis clientes de 15 a 50 años  ya que tienen mas alcance al  visualizar los productos online . y el canal mas rentable que hasta ahora   me a producido mas en por facebook (rrss)",7.0
12315250.0,37.0,694335.0,"por el canal que quiero llegar a mis clientes es por el que se esta dando hoy en día y con mas fuerza en un futuro, que es el  internet, a través de este utilizar herramientas como pagina web  y así poder mostrar mis productos y tipos de trabajo, ademas con esta pagina ligarla a redes sociales. hasta el momento los canales que ocupo son paginas de venta y por ahí viene mi rentabilidad, pero con equipamiento y publicidad a través de internet se realizaría de mejor manera. ",3.0
13638010.0,37.0,1408045.0,"nuestros servicios serán ofrecidos principalmente de forma digital, utilizando las redes sociales como instagram y facebook, donde además de vender nuestras producciones podremos fortalecer una relación mas personal con los y las clientas, teniendo un canal directo de comunicación. con este canal apuntamos principalmente a personas jóvenes y adultas que utilizan ampliamente estas plataformas para consumir material audiovisual, diseños, fotografías, etc. próximamente contaremos con una página web donde podrán buscar detalladamente nuestros packs de servicios, visualizar y conocer más nuestro trabajo, pudiendo llegar a ser un canal directo de venta, donde el cliente podrá adquirir producciones como tutoriales, conciertos privados, charlas, etc. también tendremos atención de forma presencial, implementando un centro en donde las personas puedan llegar a cotizar el servicio que necesiten, pensando principalmente en la gente que no se familiariza con los canales digitales. este mismo centro será donde trabajaremos en conjunto a nuestros clientes, ya sea en planificación, edición, sesiones fotográficas. no dejando de lado la atención por llamada o por mensaje, así como también la presentación de nuestra productora a través videos transmitidos por canales de televisión regionales y publicación de publicidad en diarios y periódicos.",7.0
15039930.0,37.0,1292516.0,"quiero llegar a mis clientes a través de: 1) letrero publicitario (en el camino hacia donde circulan los vehículos para el parque nacional vicente pérez rosales, saltos del petrohué, volcán osorno, lago esmeralda, etc.) 2) publicidad en redes sociales facebook e instagram segmentados por preferencias y sector geográfico 3) página web con posicionamiento en google ads 4) páginas especializadas: airbnb, booking, trivago, etc. 5) sernatur.
todos estos canales funcionarían muy bien para mis segmentos de clientes.
los más rentables son 1,2 ,3 y 5,  en caso del punto 4 airbnb, booking, trivago se debe pagar una comisión por el uso de sus plataformas, y el cliente debe pagar también una comisión.",3.0
13878200.0,37.0,1389415.0,"en mi modelo de negocio lo más rentable ha sido la publicidad a través de facebook, pero de la misma manera, creemos que sería productivo la difusión de medios como radios, diarios y otras redes sociales, ya que son aquellos que utilizan gran parte de la población adulta. ",3.0
10037230.0,37.0,324702.0,"los canales de comunicación serían las redes sociales como facebook, instagram y sobretodo linkedin, tarjetas de presentación, también los correos corporativos y la página web que queremos realizar con el financiamiento del proyecto.   ",3.0
14985110.0,37.0,1368899.0,"rrss, radio y publicidad de boca a boca como así también los canales rentables de mi modelo de negocio son la calidad que entregara en el servicio.",1.0
12351880.0,37.0,690609.0,"1.- recomendación por parte de los visitantes
2.- a través de redes sociales.
3.- pagina web.
4.- ferias turísticas. 
5.- marketing radial.
6.-agencias de turismo.",1.0
12513650.0,37.0,696359.0,"instagram, ya que es la mejor plataforma para visualizar y vender mis productos. ",3.0
3930420.0,37.0,1227288.0,"mis clientes me contactan a traves de las redes sociales y wasap, los cuales son más accesibles y baratas para la gestión de su negocio.",3.0
8050350.0,37.0,258646.0,"los canales de difusión mas importantes, que conozco y que se funcionan, son una fuerte campaña de difusión en redes sociales, con su base en página web para contener toda la información y generar las compras y envíos, sin embargo para captar clientes empresas, de grandes y lujoso hoteles (por ejemplo) se realizará de forma presencial y muy bien presentada, en donde celebraremos contratos de mayor volumen y con ello el impulso necesario para lograr inversiones mas robustas.  ",5.0
1197580.0,37.0,650014.0,"a través de agencia  de turismo .al comienzo de cada temporada  promocionar a través de paginas web ,redes sociales (instagram,facebook twitteer ),folleteria, captadores ,alianzas comerciales.
para el segmento local la pagina web y captadores además de las redes sociales y avisos .
para el segmento nacional página web, redes sociales , avisos.alianzas comerciales
segmento internacional ,las pagina web, agencia de turismo ,redes sociales. avisos  .
el canal más rentable sera la agencia de turismo , la pagina web alianzas comerciales  ,invitándolos a realizar rutas y  productos que promuevan actividades  al aire libre y el deporte en la patagonia .

",7.0
760680.0,37.0,343194.0,"el canal que mas sirve a nuestro negocio es la relación personal, cara a cara con nuestros clientes directos o directivos de confianza que puedan servir de puente con quienes toman las decisiones finales de cada empresa u organización. indistintamente del segmento de clientes, debemos concretar entrevistas para proponer nuestro servicio y mostrando con ejemplos comprobables del éxito de la gee en toda organización moderna. indispensable en este sentido se hace poseer una solida presentación en powepoint o similares, una tablet donde demostrar ejemplos concretos de ee en otras instituciones, mostrar graficos comparativos y explicar el modelo de negocio técnico-financiero esco donde la inversión inicial se paga con los ahorros generados por el plan de eficiencia energética. es en esta instancia donde puedo explicar, seducir y empatizar con las necesidades, miedos y sueños del potencial comprador. también es necesario un respaldo en la web de nuestra empresa, donde ofrecer el contacto directo con la organización y como eje de nuestras ofertas de servicio. donde mostrar lo que hacemos a partir de experiencias realizadas, actualizando también este soporte en torno a noticias relevantes del rubro y nuestra empresa. 
otro eje es la participacion de ferias ecologicas, de vivienda, de ernc, municipales, regionales donde tener un stand de promoción del negocio.",3.0
6401400.0,37.0,1641679.0,"a través de redes sociales, como son whatsapp e instagram, con la primera específicamente a través de listas de difusión para lo cual crearé una base de datos con personas que pertenecen al segmento de cliente apuntado. con instagram pagaré publicidad para que llegue al segmento escogido.",5.0
14595680.0,37.0,1539559.0,"como nuestros principales clientes son turistas que visitan nuestra región los principales canales de distribución son la atención personalizada y redes sociales como facebook, instagram y twetter. también publicidad que esperamos realizar a través de un buen plan de marketing digital con el que podamos llegar y ampliar nuestro segmento de clientes.
para los clientes de empresas turísticas nuestro canal de distribución será a través de folletería o catalogo que esperamos implementar con nuestro proyecto.
mi canal de distribución mas rentable es la atención personalizada en donde yo puedo explicar y dar a conocer de manera mas precisa en que consisten mis artesanías y manualidades y el otro canal rentable será la creación de un catalogo virtual para poder vender mis productos a distintas zonas del país.
",7.0
7994670.0,37.0,266282.0,"en primer lugar utilizaré las redes sociales (instagram y facebook), también pretendo tener mi sitio web y habilitar el e-comerce como canal de venta principal. además, me interesa generar vínculos o alianzas con tiendas de mascotas y veterinarias para poder darme a conocer entre mis clientes y hacerles llegar mi propuesta. por otra parte, me interesa participar de las ferias que se desarrollan en chile durante el año para poder acercar el producto a mis clientes (expo mascotas &animales, otras ferias)",3.0
12154000.0,37.0,254207.0,"el principal canal con el cual utopía llegará a los clientes es mediante redes sociales (facebook, instagram, whatsapp, linkedin, etc.), es el canal que mejor funcionará con nuestro segmento de clientes, debido a que hoy en día es un canal muy utilizado por empresas emergentes, en dicho canal esta incorporado el marketing de forma muy óptima lo que permite segmentar a los clientes como se ajuste a la necesidad del proyecto, con esto se reducen tiempos en la toma de decisiones y ejecución de planes estratégicos en la llegada al cliente por medio de publicidades.

otro canal con el cual se llegará a los clientes es por medio de ferias de emprendimientos y negocios relacionados al rubro y productos que utopía ofrece, ejemplo claro serían las ferias ecológicas, de reutilización, impactos ambientales y todos lo relacionado a la ecología y sustentabilidad. esto permitirá a utopía llegar a los clientes deseados debido a que asisten personas segmentadas ya por su interés y se sentirán identificados y querrán saber más sobre que trata el proyecto presentado.",7.0
10558300.0,37.0,1336676.0,"nuestros canales para llegar a nuestro publico objetivo son las redes sociales, facebook, instagram y youtube. estos canales son los más rentables ya que aquí entregaremos todo el contenido para nuestra audiencia. como segundo canal son las tiendas deportivas que venden suplementos y todas las tiendas que venden productos para vegetarianos y veganos.
después de la pandemia iremos a ferias deportivas y estilo sustentable para presentar nuestros productos.",3.0
12362870.0,37.0,648841.0,"mis canales serán en un local establecido en mi domicilio,para atender de manera presencial. así como también la  promoción, reserva y pedidos serán a través de redes sociales; instagram, facebook y whatsapp. por otro lado será distribuido a través de intermediarios, que serán tiendas aliadas.",3.0
12399290.0,37.0,646173.0,"para empezar, el canal indispensable es el presencial, ya que, es por ese metodo llegamos a cualquier tipo de cliente. por otro lado, el canal de plataformas digitales gratuitas, ya sea; instagram, facebook, etc. sumando la publicidad agregada que tienen estas plataformas.
los canales que mas funcionan para mi segmento de clientes serian las plataformas virtuales, ya que, nuestros principales clientes prefieren mayoritariamente infirmarse por este metodo.
los canales mas rentables son sin duda la publicidad que generan las plataformas virtuales, pero ademas, el canal presencial es de suma importancia, ya que, con la estetica se atraera al cliente de paso.",5.0
14970990.0,37.0,1441303.0,"en particular instagram ya que es una plataforma utilizada por este grupo socioeconómico y en el cual es muy fácil hacer publicidad y expandir el universo de clientes. igualmente, se planea ofrecer este servicio a través de facebook marketplace, debido al enorme alcance que se podría lograr a través de este medio. 

los canales más rentables para este segmento de clientes, además de instagram, es el boca a boca que se realizará entre los clientes satisfechos. ",5.0
15136060.0,37.0,1757231.0,página web y redes sociales.,3.0
12109140.0,37.0,259428.0,"para un primer acercamiento se utilizará la publicidad virtual, tales como página web y redes sociales, ya que éstas permiten llegar en poco tiempo, a todo el mundo y mi producto está orientado a visitantes, tanto nacionales, como extranjeros.
la etapa de la entrega del producto y servicio, se hará de manera presencial, directa y personalizada.",7.0
14913580.0,37.0,1482059.0,"mis servicios los ofrecere por redes sociales facebook, instagram  y por medios locales.",3.0
509810.0,37.0,1674661.0,"los canales por los que queremos llegar a nuestros clientes son:
para llegar a tiendas comerciales, nuestros canal principal es mediante una campaña comunicacional a través de redes sociales, pagina web , envíos de portafolio por correo directo con un amplio muestrario de diseños y materiales, envió de promociones. compartiendo muestras de los  proyectos ejecutados en el lugar  para generar alianzas de apoyo mutuo en publicidad , promoción en pequeños videos en el canal de  youtube e instragran invitándolos a pequeñas capsulas de capacitación que mejoren sus negocios. 
para llegar a pequeños emprendedores y familias en zonas más apartadas o rurales nuestros canales son radio, avisos en redes sociales en paginas de grupos de ventas o de artesanos y productores. entrega directa de folleto promocional en lugares de actividades turísticas como mercados municipales, centro cultural, ferias y oficinas de información. para llegar a un publico más familiar participar en muestra de trabajos en las ferias y festivales municipales en temporada de verano.",7.0
13861150.0,37.0,1384240.0,"3. canales:
para los clientes particulares, y debido al acceso a internet y auge que existe en el ecommerce, vamos a usar un canal principal de contacto, online y automatizado a través de la creación de una página web con formulario de contacto, carro de compras y sistema de pago. a ellos se les despachará el producto a través de un sistema de despacho 2 veces por semana. así mismo, para el primer segmento de clientes, “de hábitos saludables”, y debido a su valor considerablemente bajo y a que son en su mayoría nativos digitales vamos a establecer canales de comunicación e interacción directos, de forma online a través de nuestras redes sociales pagadas (instagram, facebook y whatsapp business). así mismo, debido a la influencia y bajísimo costo, usaremos dos canales indirectos basados en las redes sociales, ya sea de embajadores de la marca, como de otros emprendimientos relacionados con la alimentación natural, con los que buscaremos alianzas. en cuanto a canales offline, para abarcar un público mayor, vamos a establecer un canal de venta directa a través de telemarketing. asimismo y debido al impacto visual, estableceremos un etiquetado en el que destaquen las propiedades saludables de nuestro producto. a este tipo de clientes les entregaremos el producto en sus hogares a través de un sistema de despacho a domicilio. para el segundo segmento de clientes, “chef de fin de semana” estableceremos canales offline y online indirectos. de forma offline a través de tiendas gastronómicas especializadas (carnicerías, emporios, mercaditos) en las que dejaremos nuestros productos a consignación junto a un packing y una pieza gráfica llamativa en el que destaque la propuesta de valor de nuestros fermentos. así mismo utilizaremos también publicidad pagada en una radio local. para el canal online, estableceremos un contacto indirecto a través de la venta de nuestro producto en diferentes marketplaces online y google ads. las compras directas serán a cargo de terceros mientras que para las ventas online el producto se entregará en sus hogares con nuestro sistema de despacho. para nuestros clientes empresa, en pos de una mejor relación y flexibilidad estableceremos un canal directo y formal a través de telemarketing, email, carta y visita presencial. a estos clientes les haremos llegar el producto con algún sistema de despacho.",7.0
4097590.0,37.0,696520.0,"el medio más directo de venta y publicidad de mis servicios de capacitación es la inscripción de los cursos que ofertaré en el portal del sence, en dónde se informan aquellos que han sido autorizados por el sistema.
el otro canal prioritario es la inscripción de la otec en la plataforma de mercado público, que es medio de compras públicas de uso obligatorio para las municipalidades y corporaciones municipales de desarrollo social y de salud.
asimismo, en cuanto a mipymes, elaboraré un diagnóstico para evaluar cuales serían mis clientes óptimos, y me vincularé con ellos a través de comunicaciones directas, poniendo en su conocimiento un portafolio de ofertas, adecuadas a la realidad de la empresa.
en todo caso, a efectos de establecer una rentabilidad suficiente y continua de los canales de comunicación, cuento con un profesional experto, que me asesorará en la definición de una estrategia y plan comunicacional y de marketing, con indicadores de rentabilidad objetivos y cuantificables.
a partir de lo anterior, diseñaré una campaña de marketing digital, focalizada mayoritariamente en el sector que he definido como óptimo.
agregaré a lo anterior, según los resultados de las etapas previas, un programa de visitas a empresas, en las que mostraré mi portafolio personalizado.
finalmente, es fundamental el diseño y la construcción de imagen, la que me permitirá concurrir a eventos tales como ferias de emprendedores y seminarios que dicta corfo y asociaciones empresariales con la certeza de provocar el impacto positivo y credibilidad necesarios para vicular y atraer clientes.",5.0
15185900.0,37.0,1751458.0,"principalmente canal vía web, anuncios en ads, marketplaces como mercadolibre o facebook y publicaciones periódicas en redes sociales. dentro de los canales más rentables para mi negocio son todos aquellos de venta online y servicios de autoatención.",1.0
14744690.0,37.0,1318460.0,"redes sociales 
página web
volantes 
tarjetas de presentación ",3.0
11990080.0,37.0,231897.0,"segmento n°1: venta directa (tradicional y electrónica).
 
a) redes sociales, el perfil del segmento n°1 tiene a lo menos una red social y la revisa varias veces al día, es por esto que, es una modalidad cercana y cómoda para nuestros clientes de solicitar cotizaciones y realizar pedidos. desde el punto de vista operacional y financiero este medio solo requiere de pago de plan de internet y una persona que responda los mensajes. 

b) vía telefónica y whatsapp, nuestros clientes nos solicitan información a través de esta vía, información relacionada a la disponibilidad de tiempo para trabajar, tipos de perfiles y materialidad de las ventanas, costo por metro cuadrado, entre otros. desde el punto de vista operacional y financiero, el proceso es simple y se requiere de un plan de celular y una persona que responda los mensajes y las llamadas.

c) visitas presenciales, esta instancia se realiza para la toma de medidas y realizar cotizaciones formales en terreno, es de importancia para el cliente, ya que es donde se sugiere la materialidad a utilizar según el tamaño y ubicación de la ventana. desde el punto de vista operacional y financiero, se requiere de traslado, personal capacitado y papelería de cotizaciones.   

segmento n°2 (venta directa, tradicional y electrónica):

a) página web, este segmento tiene la necesidad de cotizar en varios lugares, previa contratación del servicio, es por esto que utilizan el internet para hacer la tarea más fácil, solicitando la contratación formal y disponibilidad de tiempo. la operación de este medio es simple y barato, pago de mantención de la página web y horas de personal dedicadas a la respuesta de las cotizaciones.

b) visitas presenciales, esta instancia se realiza para toma de medidas y realizar cotizaciones formales en terreno, este segmento siempre quiere un porcentaje de descuento y es en esta instancia, donde se realiza. desde el punto de vista operacional y financiero, se requiere de traslado, personal capacitado y papelería de cotizaciones.   
",7.0
5135200.0,37.0,1343645.0,"se contará con una plataforma web, donde se incluirá la oferta completa de alimentación, insumos y accesorios, también puntos de atención telefónica y a través de redes sociales.

para el segmento 1, de usuarios habituados a las compras online, la plataforma es la mejor opción, donde podrán realizar compras directas y suscribir sus entregas periódicas.

para el segmento 2, el canal de atención telefónica directa permite la comunicación efectiva y rápida coordinación de despachos, entregando la opción de generar nuevas suscripciones a partir de la habitualidad de solicitudes. por otra parte, se utilizará la presencia en ferias libres, para mostrar los productos y generar contactos de venta directamente.

el canal más rentable es el web, dado el menor costo de adquisición de nuevos clientes, y la opción de mostrar toda la gama disponible de alimentos, accesorios e insumos, incluyendo ofertas segmentadas y personalizadas.
",7.0
15313890.0,37.0,1414784.0,"la principal fuente de publicidad será a través de redes sociales, debido a que abarca mucho mas publico y el turista extranjero suele preferir las recomendaciones de paginas internacionales para elegir cual será su futuro destino y empresa en la cual va a contratar. otra plataforma será a través de una pagina web que nos de a conocer mas personalmente y mostrar la experiencia de las personas que realicen tours con nosotros. ",5.0
7321330.0,37.0,1638390.0,"para la realización de mis servicios, siempre será de manera presencial, ya que ofrezco servicios de belleza los que debo realizar directamente al o la cliente y tengo dos lugares para tal realización: en mi hogar o en el domicilio de quien lo solicite.  
para movilizarme lo hago con mi automóvil lo que brinda comodidad y libertad al trasladarme de un domicilio a otro. 

para para ofrecer y dar a conocer mis servicios lo hago a través de redes sociales: instagram y facebook, los canales más usados de mi público objetivo y donde muestro cada trabajo, lo que hace más requerido y rentable mi negocio. 


",5.0
14948760.0,37.0,1571184.0,"los canales que mejor funcionan para llegar a mis clientes, y son más rentables para mi idea de negocio, son el canal presencial (que son ferias libres, ferias de emprendimiento, y principalmente el boca a boca de nuestros y nuestras clientas que nos recomiendan).
también los canales digitales, ya sea instagram, facebook y en algún momento pagina web, esto es fundamental para tener un  buen impacto en la industria y un alcance de todo el territorio nacional. 
",3.0
14815660.0,37.0,1446087.0,"los canales de distribución que se emplearán para la comercialización de los productos serán a través de la venta directa y venta indirecta digital.
se realizará una modalidad de venta digital empleando los diferentes medios tecnológicos como redes sociales instagram, facebook, página web, whatsapp. este canal de comercialización es útil para los diferentes segmentos de clientes que nos enfocaremos.
por otra parte, también se comercializarán los productos mediante compra directa para establecer una relación de confianza y atención personalizada con los clientes.  esta modalidad de venta resulta principalmente adecuada para el segmento de clientes adulto mayor.
en estos tiempos de pandemia se priorizará la comercialización digital mediante la creación de una tienda de salud andina virtual, como vía más segura y rentable frente al difícil contexto socio- sanitario que nos encontramos. la presente inicia tiene como objetivo un alcance tanto a nivel local como nacional, por lo tanto, nuestra primera línea de trabajo es la  comercialización on-line.
",7
1528950.0,37.0,1388541.0,"canales de venta presencial, contactando a conocidos y amigos que se cuentan con este sistema en primer lugar, y a traves de publicidad como letreros con mi contacto para llegar a demas personas. y de manera virtual a traves de redes sociales.",3.0
8973430.0,37.0,568548.0,"redes sociales 

venta presencial

correo electrónico",3.0
9446350.0,37.0,305888.0,"contaremos con una sala de ventas para que los turistas nos  puedan venir a visitar y conocer nuestras instalaciones, conocer el proceso, degustar y comprar nuestros productos ya que este segmento de clientes (turistas) es precisamente lo que busca 
. también queremos llegar a nuestros clientes a través de un sitio web, como también  utilizar medios de comunicación como radio y televisión local la cual es altamente escuchado en la zona, dado que a través de estos canales abarcamos a los segmento de jóvenes y adulto-jóvenes  que adquiere productos vía web y presencial y el otro segmento será abastecido a través de botillerias por que así facilitamos el acceso al producto.",7.0
