postulante_id,pregunta_id,respuesta_id,texto.respuesta,nota
10071940.0,37.0,1228852.0,"de acuerdo a la inestabilidad sanitaria, la venta de nuestro producto través del e-commerce debería ser potenciada, ademas, colocar nuestros productos a la venta al por mayor para cadenas de distribución, restaurantes y bares cerveceros.
no obstante a ello, buscamos realizar prontamente una integración vertical hacia adelante. nuestro objetivo más rentable es vender productos en nuestros propios puntos de venta.",3.0
16449770.0,37.0,2510499.0,"la forma de comunicar a los clientes la presencia de este almacén, será con letrero grande y luminoso en el acceso, así también sirve para que lo identifiquen quienes circulan por la carretera.
se harán redes sociales del almacén para dar a conocer la oferta disponible, llegada de productos, promociones, horarios de atención.",3.0
9719920.0,37.0,650704.0,"los principales canales de distribución, difusión de la información y promociones con la cual se espera llegar a los distintos segmentos de clientes son:

turista nacional: paginas web, videos, tarjetas de presentación, redes sociales (instagram, facebook, whatsapp), agencias de viaje y de turismo, organismos públicos (sernatur, oficinas de turismo).

turista internacional: paginas web, videos promocionales, redes sociales, agencias de viaje y turismo, organismos públicos, email marketing, empresas de distribución y difusión.

pescadores deportivos: pagina web, videos promocionales, tarjetas de presentación, tiendas asociadas especializadas en pesca deportiva, redes sociales, agencias de turismo, empresas de distribución especifica.

los canales mas rentables para este modelo de negocio y con mayor alcance a nuestros distintos segmentos de clientes son los canales web como pagina web y redes sociales. esto debido al gran difusión de la información que generan estas redes alrededor de todo el mundo.",7.0
14999650.0,37.0,1447099.0,"para el cado de los particulares, principalmente se realzara venta a travez de medios digitales como rrss,  facebook e  instagram que son los mas utilizados para estos fines, luego esperamos que el llamado coloquialmente boba a boca amplie nustro mercado, ya que si uno entrega un buen servicio de venta y entrega de los productos eso se replica de buena manera, abarcando mas clientela.
para el caso de las emrpesas realizaremos inicialmente venta directa a traves de visitas para dara  conocer nuestra oferta y condiciones especiales de pagos para este tipo de clientes ademas de informar de los canales digitales de ventas que dispondremos para futuros pedidos.
ademas en el lugar de almacenamiento de las  mercaderias se dispondra de un punto de venta en el caso de que alguno de nustros clientes empresas o particulares desser pasar a comprar presencialemnte",7
10398990.0,37.0,365044.0,"estamos viviendo el boom de las redes sociales por lo tanto nuestro enfoque principal son instagram, facebook y entre otras plataformas. gracias a la facilidad y alcance de tener solo una red wifi y un equipo móvil hemos podido promocionar y dar a conocer la cotidianidad de nuestro emprendimiento y productos en parte de la región, tener fidelidad con algunos de nuestros clientes, donde atravez de correo electrónico y ventas presenciales hemos podido realizar la programación y entrega de nuestros productos.

- instagram: en esta plataforma nos enfocamos en el publico adulto joven que se encuentra actualizado en redes sociales, donde la red se encarga de mostrar lo que el joven quiere comprar solo a un click y desde la comodidad de su hogar.

- facebook: este medio es mas utilizado por adultos mayores a 35 años, quienes enfocan sus compras pensadas en la familia.
 
- correo electrónico: será utilizado en el segmento de nuestros grandes clientes. donde podremos  establecer una relación mas formal y corporativa.

nuestras proyecciones a futuro son hacer crecer nuestra empresa y abarcar nuevos canales, como publicidad en medios masivos, televisión, radio e internet, así  abordar segmentos de clientes que hasta el momento quedan fuera. ejemplo en radio y televisión regional, ya que son estos medios los que nos llevaran a posicionarnos en el mercado y conquistar al segmento de clientes adulto mayor quienes por excelencia son consumidores de nuestras tradicionales recetas chilenas",5.0
14677940.0,37.0,1183128.0,"a los supermercados y exportadoras mediante marketing dirigido a empresas, a clientes en el extranjero mediante redes sociales, aplicaciones de compra y venta de frutas y verduras.",5.0
1186680.0,37.0,377763.0,"nuestros principales canales de venta y distribución será a través de internet con una pagina web dinamica, simple y que permita arrendar de forma sencilla e inmediata nuestros equipos, ademas desarrollaremos multiples convenios con los servicios turisticos de la comuna y el territorio, agencias, hoteles, hostales, complejos turisticos y restaurantes, seran parte de nuestra red que permita acceder a los turistas que se encuentren en la comuna y deseen realizar un recorrido por los principales atractivos turisticos. por ultimo consideramos de primera necesidad generar una estrategia de posicionamiento a traves de redes sociales (facebook e instagram) para relacionarse directamente con el turista y capturar solicitudes de arriendos.",7.0
3079910.0,37.0,1774182.0,"a través de la venta directa al público en general en el mismo local comercial, a través de las redes sociales para entrega a domicilio, a través de la pagina web has tú pedido y recógelo en el mismo local.",3.0
15246560.0,37.0,1574565.0,"el boca en boca seria el canal idoneo, ya que de esa manera las personas pueden compartir sus vivencias y la experiencia que fue haber visitado el camping en el oasis del desierto más arido del mundo, otro canal que serviría para llegar a los cliente son las redes sociales como instagram o facebook. adicionalmente una pagina web seria un canal clave para poder realizar reservas.",3.0
15030950.0,37.0,1517272.0,"segmento 1: 
manera presencial en puntos de venta, ventas online, publicidad online, con medios de pago (efectivo, transferencia, pago con tarjetas crédito o debito) 

segmento 2: ofreceremos productos en catálogos digitales de todos los productos principales y personalizados con ventas a través de redes sociales, pagina web, llamadas, whatsapp, correo electrónico donde habrán ofertas exclusivas y descuentos para clientes y también de manera presencial (ferias artesanales, exposiciones). contamos con transferencia bancarias, pagos con tarjetas de créditos o debito, efectivo.
los envíos se harán a través de encomiendas donde el cliente prefiera la empresa que le convenga, también tendremos entregas de manera presencial adecuándose a las medidas necesarias que se vive en el país. 

para nuestros clientes de la tercera edad de la zona, las ventas serán presenciales donde el cliente se puede acercar al punto de venta para ver de manera presencial su producto, las entregas se harán de forma presencial con las medidas necesarias por la situación que vive el país.

segmento 3: para las empresas nuestros canales de ventas puedes ser online (correo electrónico, pagina web, whatsapp) con pagos a través de transferencias bancarias, tarjetas de crédito o debito, efectivo, en cuotas dependiendo del monto de la compra, a través de orden de compra, licitaciones en el mercado publico, reuniones presenciales ya a través de canales de conferencia (zoom, meet, etc) ",7.0
5117300.0,37.0,1454850.0,"para el primer segmento los canales que se utilizan son la web propia, el boca a boca. las redes sociales pueden presentarse también como canales con una alta repercusión en la venta, a la vez que pueden representar un costo acotado para la empresa. su importancia pasa porque permite conocer cómo se toman las decisiones de compra y qué canales usan, son aspectos determinantes para que podamos integrarnos en la rutina de compra de los clientes. para el segundo segmento, los canales a utilizar serían foros o charlas donde poder encontrar pymes o lugares en la ciudad donde se reunan los emprendedores. son elementos que debemos desarrollar para una buena distribución de la oferta presentada. además de la presencia en la zona de ubicación de la empresa, a través de folletos en otros establecimientos locales, oficina gubernamentales (centro de negocios, asociaciones gremiales, fomento productivo), anuncios en revistas o cartelería, se presenta como una canal de distribución de gran interés y juegan un rol fundamental, ya que a través de estos los clientes van a poder conocer que existe este servicio. para el tercer segmento los canales de distribución o atención son los portales especializados a nivel nacional (ferias nivel nacional de emprendimiento) y a través de nuestra web. estas son esenciales para que se produzca la decisión de compra, además de prestar especial atención a las redes sociales, blogs y foros de empresas, sin olvidar que permite a los clientes, y a los potenciales clientes, conocer los atractivos los servicios ofrecidos.",7
2230440.0,37.0,613996.0," realizó venta directa a los clientes, también hacen reserva de pedidos vía telefónica  (pasteles y/o salado), esto es para todo los segmentos de clientes. 
donde más vende es cuando hace la venta directa de sus productos en el horario de la barcaza de lunes a domingo. ",3.0
14903100.0,37.0,1541008.0,"tengo difusiónes vía wasap,  tarjetas, faccebok, como también voy implementar avisos radiales.
los canales que funcionan mejor para mis clientes son redes sociales vía difusión wasap.
",3.0
12268310.0,37.0,319918.0,"los canales para llegar a mis clientes y potenciales clientes estaría dado por las redes sociales como fan page de facebook, radio local y una entrega personal a los negocios establecidos, cuento con movilización propia para el traslado. el canal más importante que considero sería el visitar personalmente los negocios establecidos y lograr fidelizar los clientes",3.0
12378120.0,37.0,690172.0,"nuestra clientela es una familia de magallanes, la cual está interesada por el reciclaje y el medio ambiente. el cual está informado sobre las implicancias de la basura generada, la importancia de disminuirla. este cliente, es un cliente informado, el cual está exigiendo la presencia de agricultores zonales con tendencias a productos inocuos. 
debido a esto, el principal canal utilizado serán las redes sociales (instagram, facebook y youtube). seguido por los medios locales en días específicos (revista fem los días viernes y el magallanes los días domingos). 
",3.0
15017230.0,37.0,1694441.0,"para lograr llegar al primer segmento, que son estudiantes desde los 15 a 25 años, el mayor alcance que hemos logrado es a través de las redes sociales, tales como instagram y facebook principalmente. en donde los clientes al tener satisfacción con el producto,  comparten el negocio en redes sociales, lo que conlleva a que sus amigos interactúen con momento sushi en la plataforma.

el segundo y tercer segmento de clientes, son personas que tengan una dieta vegetariana y/o vegana, en estos segmentos también se interactúa a través de redes sociales, principalmente en grupos donde solo participa este segmento, pudiendo así llegar a mas posibles clientes. además de lo mencionado, como canal secundario se puede mencionar la difusión por los sectores al rededor de la ubicación del negocio, a través de flyers. 

el cuarto segmento, que corresponde a adultos y adultas jóvenes, se ve interceptado por canales como lo son las diferentes plataformas de redes sociales, principalmente instagram.

el quinto y ultimo segmento, correspondiente a trabajadores y trabajadoras de empresas cercanas a la ubicación del negocio, se ven principalmente captados por los canales de difusión como flyers y letreros ubicados en la calle que da con el negocio. este es el principal canal ya que pueden visualizarlo al llegar o salir del trabajo, al igual que a colación.  
por consecuencia, nuestros canales mas rentables y con mayor interacción son las redes sociales, como segunda opcion y no menos importante, son los flayers y magneticos.",7.0
11619350.0,37.0,212002.0,"nuestros clientes están segmentados dependiendo de la edad, prioridades y comodidad, por esta razón vamos utilizar canales como las vías telefónicas, paginas webs, folletos, radios, redes sociales ( facebook,twitter, instagram, etc.), vendedor integral y personalizado, siendo este ultimo el canal mas eficiente para vender, ya que en venta directa se ofrece y entrega el producto de nosotros a nuestros clientes, no dejando aparte el aprovechar las redes sociales para llegar a mis segmentos de clientes, como lo son a las madres y padres y jóvenes que no tienen tiempo para poder ir al mercado, negocio, etc., así nosotros tendremos un venta mas eficiente y mas activa .otro tipo de canal es tener nuestro vehículo con nuestro logo y marca de esta forma seremos mas visibles a la comunidad llegando a mas lugares, como distintas ciudades, regiones y por que no a lo largo del país, incorporando venta personalizada. utilizando las redes sociales seremos eficientes y mas rentables. 
",5.0
204440.0,37.0,284199.0,"vía trato directo.
sala de ventas de la agrupación artesanas peumayen del aeropuerto ( integrantes y socia fundadora).
redes sociales (facebook, instagram)
tarjetas de presentación y flier informativos
entrega en locales establecidos en temuco y santiago.",3.0
5342290.0,37.0,404627.0,"al comienzo el principal canal será la venta directa en las instalaciones de la cervecería e indirecta a traves de internet, (páginas web, redes sociales) con el tiempo se pretende abarcar un abanico variado de distribuidores entre distintos bares, pubs, botillerias y eventos de exposición de cervezas.
el mejor canal para llegar al segmento de mis clientes será la venta directa y personalizada para desarrollar interés en el público y generar un boca a boca que nos ayude a intruducir el producto exitosamente en el mercado.
el canal más rentable para llegar a nuestros clientes sería el personalizado, para así explicar las características y beneficios que tiene nuestro producto.",5.0
9093790.0,37.0,1315401.0,atravez de anuncios redes sociales y boca a boca con la buena calidad de mis productos ,3.0
6044850.0,37.0,1392428.0,"a mis clientes llegare a traves de 3 canales 1.-  radio y tv: mediante campañas permanentes entregando información de las promociones y actividades, la radio es para los adultos. 
2.- redes sociales: cuenta de facebook , instagram de la granja, donde se realizaran las  publicaciones y concursos regularmente para mantenerse visible a todo quienes participan de la comunidad de facebook. este medio es principalmente para los adultos jóvenes que estan casi un 90% conectados y que manejan las redes sociales.
- folletería: este medio es principalmente para las delegaciones de colegio y adultos mayores, donde acudire personalmente a entregarla ya sea a sernatur, municipalidad, colegios etc.

",7.0
14986590.0,37.0,1740855.0,"1. plataformas online de concursos públicos como mercado público y licitaciones, entre otros. 

2.a través de redes sociales. facebook, instagram, etc.hoy en día se a transformado en el centro de los emprendimientos y pymes.

es clave contar con manejo online, nuestro marketing digital debe ser de primer nivel porque la mayor rentabilidad se dará en redes sociales.",7.0
14707830.0,37.0,1235085.0,"nuestro primer canal abarca las redes sociales, pues esto contempla a nuestros tres segmentos. dichas redes sociales son instagram y facebook. además de contar con nuestra propia página web. estos canales son los más adecuados debido a que los estudios avalan que las personas de entre 28 y 38 años utilizan con frecuencia esta modalidad para comprar o para buscar opciones de diseño para integrarlos en su vida, al ser gratuitas con posibilidad de pagar por publicidad, sería lo más rentable para nuestro modelo de negocios, de igual modo, la página web es un mecanismo esencial para la venta de nuestros productos, pues la compra será realizada por la página web, por medio de canales como webpay, o transferencias bancarias. operacionalmente es lo más adecuado, debido a la contingencia social y mundial que a la fecha estamos viviendo como sociedad, pues es la medida más acorde a la realidad sanitaria.
para el tercer segmento, habría una distinción en cuanto al uso de redes, pues se usa linkedin, ya que es el medio de comunicación más utilizado por las empresas. financieramente es la más adecuada, pues es gratis, con opciones de pagar una suscripción acorde a la realidad financiera de nuestra empresa. operacionalmente se ajusta a la realidad de las organizaciones, pues estudios avalan que la mayoría de las empresas trabajan bajo esta modalidad digital. 
todas las plataformas derivarán hacia la página web, siendo esta el medio único de compra, esto es para tener una mayor seguridad y transparencia al momento de realizar las transacciones. 
también está la posibilidad de entregar afiches publicitarios en negocios físicos, condominios y departamentos, con previa autorización y mientras sea posible en relación con las medidas sanitarias propuestas por el gobierno. 
",7.0
15083000.0,37.0,1707275.0,"en el primer segmento que consiste en  los adultos jóvenes, (hombres y mujeres),  segmento que va entre 18 y 38 años de edad, con o sin pareja, que vivan en chile, región metropolitana, comuna conchalí, sin hijos, dependientes, que posean ingresos entre 400000 y 1000000, que trabaje fuera de su vivienda, que tengan una o más mascotas, las quieran, se realizara un canal virtual, la nueva modalidad de comercialización que ha hecho que las empresas que concentran sus ventas, además se incluirá en los canales de distribución paginas web, redes sociales, wapsat, facebook, se promocionara por google, por que este segmento siempre esta unido a las nuevas tecnologías y su forma de comunicarse es por estas vias, por tanto tendrá mas efecto para la compra y promoción de los productos
en el segundo segmento mujeres, dueñas de casa, de entre 20 a 40 años, con ingresos de 300.000 a 700.000 con o sin pareja, dependientes, que vivan en chile, región metropolitana, comuna conchalí, que ellas estén a cargo de sus hijos, los que poseen mascotas (perros y gatos), los canales de distribucion que usara chigatper, es pagina web, redes sociales, teléfono, wapsat, además, se aprovechará la difusión física a través de volanteos que detallen nuestro producto y servicios en ferias, puesto que las dueñas de casas van una o dos veces por semana, también veterinarias de la comuna dando precios especiales y eventos al aire libre. también aprovecharemos en promocionar nuestro producto y servicios a través de las campañas gratuitas de vacunación que realicen las municipalidades.
",7.0
9696890.0,37.0,212853.0,"los canales que utilizaremos para contactarnos con nuestros clientes serán : presencial (entrevistas personales, charlas y talleres gratuitos para padres), promoción en redes sociales ( millennial), promoción física ( flayers y papelería), medios de comunicación inmediata (radio), plataforma digital exclusiva e inmediata de atención a padres y apoderados.",3.0
15180030.0,37.0,1622635.0,"por medio de redes sociales, pagina web, paginas relacionadas al rubro, seminarios y ferias. plataforma e-learing
ferias laborales, sindicatos, encargados de rrhh en las empresas, comites de bienestar.
centros comunitarios, omil, sence, otic, centros de adultos mayor, senama, mercado publico
por medio de internet",3
12682580.0,37.0,1567458.0,"por intermedio de ventas directas para la comodidad de nuestros clientes como los adultos mayores,  y de delivery al resto de nuestros clientes que así lo soliciten, como por ejemplo adulto joven, y/o negocios.
los canales para llegar a nuestros clientes que mejor nos funcionan son la recomendaciones de persona a persona, y las redes sociales como facebook e intagram.",7.0
14854600.0,37.0,1491512.0,"el proyecto pizza napoles en 4 ruedas pretende entregar un servicio personalizado a mi cliente. la modalidad carro food truck pretende demostrar a mi futuro cliente la forma correcta de manipulación de los alimentos, preparando in situ el producto elegido por el cliente. un producto artesanal tipo gourmet, con salsa casera y vegetales y verduras frescas cocinadas u horneadas directamente en el horno. entregamos un formato diferente no existente en el mercado de las pizzas artesanales en la comuna de machali, formato trozo y arma tu pizza, dando la elección al cliente de elegir sus  ingredientes preferidos y en tamaño según su necesidad y valor a cancelar. este servicio comida al paso, cumplirá con las exigencias tanto en rapidez como en calidad. adicional mente ofreceremos una linea telefónica/whastsapp para que nuestros clientes una vez fidelizado con nuestro producto puedan solicitarla de manera anticipada y retirarlos al momento de llegar a nuestra ubicación.",3.0
12135610.0,37.0,237026.0,"los clientes se podrán comunicar con la compañía por medio de tres canales que
son: por teléfono al cliente a nivel local y nacional, redes sociales en 
internet (facebook y twitter), y correo electrónico (el cual será visible en la página web
de la organización). todos estos canales, permitirán al cliente una comunicación directa
con el personal de la empresa, ya sea para realizar sugerencias, reclamos, preguntas,
dar opiniones, hacer cotizaciones, o cualquier otra actividad que este en relación directa
con “camping
por medio de redes sociales, dando a conocer mi servicio de camping con tinajas, por medio de booking.",5.0
12146050.0,37.0,315387.0,"segmento 1: pacientes de la tercera edad con problemas cardiovasculares y diabéticos: canal de venta directa entre mi clínica y el consumidor final del servicio.

segmento 2: pacientes de 30 a 40 años sin problemas de salud pero que demandan atención por encarnación de uñas, principalmente deportistas: canal de venta directa entre mi clínica y el consumidor final del servicio.

existen canales audiovisuales y electrónicos que pretendo poner en marcha una vez iniciado el proyecto. esto es a través de medios de difusión de la comuna y en el local para atraer nuevos clientes, y vía teléfono e internet para atender los pedidos de forma eficiente.
",5.0
15083170.0,37.0,1775654.0,"el canal de distribución es la venta directa en el local comercial, además del reparto a otros establecimientos comerciales que sean clientes directos de nuestro negocio. 
es importante destacar que utilizaremos las redes sociales solo para la difusión de nuestro negocio, no así para la venta. ",3.0
14841340.0,37.0,1520791.0,"al ser nuestros segmentos de clientes turistas que no pertenecen a la zona llego a ellos a través de publicidad en redes sociales (facebook, instagram y whatsapp) y las propias recomendaciones de mis actuales clientes, eso ha influido en el aumento de mis ingresos. además a través de publicidad en otros servicios que existen en la comuna tales como de alimentación, alojamientos y oficinas turísticas, en los cuales se deja la folletería y tarjetas de presentación para dar a conocer nuestro emprendimiento. con el segmento 1 que es el familiar el canal que funciona mejor es el de contacto a través de las redes sociales y correo electrónico para la elaboración de las pautas de actividades que se contemplarán dentro del servicio para que esta sea inclusiva para todos los integrantes del grupo
familiar que se incluirán dentro de la experiencia, este canal es rentable para nuestro emprendimiento puesto que no conlleva un gasto económico mayoritario. para el segmento 2 el canal que mejor funciona es el de contacto vía telefónico, el cual mayoritariamente consiguen a través de otros pescadores recreativos y en los servicios complementarios como hospedajes y oficina turística a través de tarjetas de presentación con quienes tenemos alianzas estratégicas para crear paquetes turísticos para los pescadores y otros. este tipo de canal igual es rentable para nosotros como emprendimiento ya que los costos son bajos y nos permiten un alcance de varios clientes sin mayor inversión monetaria.
",3.0
14904220.0,37.0,1511499.0,"1.- cliente personas naturales : canal de distribución a través de despachos propios y/o aplicaciones de reparto a domicilio, nuestros canales de difusión serán  a través de rrss whatsapp, instagram ,facebook y la implementación de una pagina web con información necesaria para nuestros clientes.
2.- cliente empresa canal de distribución a través de despachos propios y/o aplicaciones de reparto a domicilio y  reparto a diversas regiones de nuestro país, para así extender nuestra bolsa de clientes empresarial, cabe mencionar que nuestros canales de difusión serán  a través de rrss whatsapp, instagram ,facebook y la implementación de una pagina web con información necesaria para nuestros clientes.
por parte pretendemos realizar publicidad en nuestro medios regional araucanía y posteriormente extendernos al resto del país.  ",3.0
8371480.0,37.0,282704.0,"mayormente a traves de rrss (instagram, facebook, soundcloud, entre otras) mayoritariamente con material audiovisual, fotográfico y musical, también abarcar el segmento prensa para quienes no cuenten con acceso liberado a estas mencionadas redes.",3.0
