postulante_id,pregunta_id,respuesta_id,texto.respuesta,nota
12405850.0,37.0,693231.0,"para ofrecer y mostrar mis productos utilizaré medios publicitarios radiales y gráficos. para invitar a los vecinos a que realicen sus compras en mi local utilizaré publicidad radial; para que los vecinos sepan dónde queda mi local y puedan diferenciarlo utilizaré publicidad gráfica, carteles, letreros, otros.
tendré la modalidad de entrega de pan para su venta en negocios establecidos de la comuna que en alguna oportunidad me han solicitado el servicio, así como pan para preparaciones en emprendimientos de comida rápida, pero con mi actual capacidad de producción y sin formalización no hemos podido atender.
el de publicidad radial funciona porque llega a todos los hogares de la comuna, anunciando mis productos en todos los sectores.
habilitaré una forma de pago en línea o transacción, de forma que los clientes que están acostumbrados a este medio de pago se sientan con absoluta comodidad
ofreceré mis productos a diferentes servicios públicos a través de publicidad gráfica (trajeta de presentación, volantes) y por medio de publicidad en redes sociales habilitando una dirección web que esté vinculada a redes sociales para ofrecer mis productos agregándole valor turístico.
la distribución de la publicidad gráfica será en el punto de venta del balneario cocha resbaladero involucrando a turistas a quienes se les entregará el volante manualmente para que  puedan ubicar nuestro local en el pueblo con sus horarios de atención y otros productos que ofrezcamos. este punto de venta debe ser intervenido en cuanto a  imagen, conservación y traslado del producto.
",7.0
12556750.0,37.0,1364851.0,"al día de hoy la mayoría de nuestras ventas las hacemos mediante redes sociales:
facebook: grupos de artesanos, grupos de ventas de distintas regiones, marketplace, paginas de ventas.
instagram: funciona como una vitrina virtual, donde tenemos mas interacción con nuestros clientes
whatsapp: grupos de ventas.
spotify: contamos con un podcast, donde explicamos el origen y la historia de nuestra idea de negocio y nuestra artesanía. 
boca en boca: venta a familiares, amigos o gente de la comunidad.
sentimos que el canal ideal para hacerlo mas rentable seria una pagina web o una vitrina virtual donde podamos unir o poner en conjunto todos los medios de promoción que ya utilizamos. ",3.0
12407900.0,37.0,613697.0,"para llegar a nuestros clientes hemos considerado los siguientes canales:
1. habitantes de puerto guadal: tenemos diversos canales de difusión para este segmento. lo primero es la difusión presencial directa. el solo hecho de caminar por pto. guadal y conversar con la gente al respecto de la iniciativa es una forma muy efectiva de invitarlos a participar. también se pueden aprovechar instancias de reunión masiva como el mercado de los jueves y sábado en el pueblo, reuniones de asociaciones de diferentes tipos, reuniones en la escuela, etc, con el objetivo de dar a conocer de forma verbal las diferentes actividades de aurora patagonia. la radio es otro canal muy efectivo en pto. guadal, habiendo una emisora que es la que se escucha en el pueblo. junto con esto, una campaña de comunicación por medio de flyers es otro de nuestros canales para llegar a nuestros clientes. hay diferentes locales donde se pueden pegar los afiches: supermercados, minimarkets, ferretería, mercadito, restaurantes, cafetería, asociaciones de vecinos, la radio, la posta, por mencionar algunos. además, también nos apoyamos con redes sociales, principalmente facebook, para poder llegar a aquellos que están conectados a través de este canal. la mayoría de estos canales no representan costos de difusión o si los hay, son muy bajos. 
2. visitantes nacionales  y extranjeros: aquí tenemos dos canales clave para llegar a nuestros clientes. difusión por medio de afiches en diferentes lugares de pto. guadal y alianzas de difusión con diferentes proveedores de servicios turísticos en el pueblo (campings, hoteles, hostales, restaurantes, cafeterías) y otros locales comerciales (mercadito, supermercados, minimarktes principlamente). en general la gente se entera por el boca a boca y recomendaciones. por otro lado, es muy importante nuestra campaña en redes sociales (instagram y facebook), ya que los turistas utilizan mucho estas redes para sacar datos y recomendaciones. además, es super importante la presencia en aplicaciones como google maps, maps.me, ioverlander, entre otras, donde los turistas revisan los atractivos de cada lugar que visitan. el costo de los canales digitales es relativamente bajo, ya que el diseño de las piezas gráficas los hacemos de forma interna. en general el costo más importante es en el pago de avisos en facebook o instagram para campañas masivas.
para ambos casos, aurora patagonia contará son señal ética en el camino de pto. guadal a chile chico, para hacer referencia a la ubicación donde se llevan a cabo las actividades y donde se explicitan los principales servicios.",7.0
7048640.0,37.0,1760865.0,"nuestros canales de ventas son propio/directo ya que nosotros elaboramos el servicios solicitado y  nos preocupamos dé entregarlo a través de plataformas digitales, según sea su caso. los canales de comunicación online para acercarnos a nuestros clientes son internet (redes sociales y plataformas web y mailing),  también utilizaremos el telemarketing y visitas presenciales para concretar visitas y seguimiento de los servicios que se están realizando.
",3.0
8326070.0,37.0,1352477.0,"segmento 1:  en este segmento los grupos y el mercado son esenciales, el boca a boca es necesario así como las recomendaciones, las redes sociales sin duda deben estar y no quedarse atrás, siempre estar vigentes.

 segmento 2:

 en cuanto al grupo de vehículos necesitamos salir a mercado fuertemente, el gasto usualmente s mayor y por ello el trato que se busca es mas cercano lo cual hace necesario muchas veces presupuestos a domicilio como pretende este equipo de trabajo",7.0
13212710.0,37.0,1612538.0,"los canales con los cuales quiero llegar a mis clientes son el presencial y online.
siendo estos los canales que funcionaran mejor para los segmentos destinados lo definiremos de la siguiente manera y por segmento. 

1.	el primer segmento serán pymes y empresas que cuenten con riesgos inherentes a la labor que desarrollan., aquí ocuparemos el canal online, a través de instagram, facebook y whatsapp, así como también podremos mejorar el servicio con ventas presenciales, ya que parte de este grupo etario le gusta o prefiere la formalidad.

2.	el segundo segmento serán trabajadores particulares y contratistas. 
aquí ocuparemos solamente el canal online, a través de instagram, facebook y whatsapp, así como también se podrá implementar una pagina web, para poder tener una herramienta con más valor a esta propuesta.


3.	el tercer segmento serán empresas de la región que requieran asesorías en prevención de riesgos. aquí ocuparemos el canal online y presencial, a través de instagram, facebook y whatsapp y pagina web, así como también podremos mejorar el servicio con ventas presenciales, ya que este grupo le gusta o prefiere la formalidad
estos canales digitales son los más adecuados ya sea porque son de fácil acceso para los segmentos antes descritos, por una parte, la gran mayoría tiene acceso a internet donde podrán ocupar el canal digital y con esto nos facilitara la operación de nuestro negocio, acotando tiempos y gastos innecesarios. por otra parte el canal presencial de la una formalidad esencial para los servicios que estas empresas y clientes requieren
",5
8770510.0,37.0,313731.0,"los canales mas rentables de nuestro modelo de negocio son las redes sociales, actualmente como equipo estamos trabajando el marketing digital, lo que nos ha entregado muy buenos resultados ya que mas del 70% de nuestra demanda surge de redes sociales como instagram y facebook, publicidad que por cierto es pagada en estas redes. 
otro canal que ha potenciado nuestros canales de información es el boca a boca, ya que dada la calidad de nuestros productos hemos podido arraigar rapidamente a nuestros clientes a lo que ellos corren la voz y asi llegamos a mas clientes. ",3.0
14869720.0,37.0,1637079.0,"educ-line será difundido a través de representantes de venta que ofrecerán el servicio a distintas instituciones educacionales.  

el primer segmento de clientes son los colegios particulares, municipales y subvencionado, el cual el ejecutivo presentará a los directivos del establecimiento el servicio de educ-line por medio de charlas y demostraciones gratuitas para probar el servicio. se establece que es la mejor manera para que la plataforma llegue directamente a las distintas instituciones educacionales  

en el caso de los colegios municipales y subvencionado,?también se necesitará adicionar propaganda en el servicio local de educación y municipios, en el caso que en un futuro se establezca una alianza con ellos y se instaure en todos los colegios municipales y/o subvencionados. 

para los docentes particulares, se estimó que la manera más optima de llegar a ellos es a través de redes sociales (instagram, facebook, tiktok, twitter, entre otros), utilizando estrategias de marketing. 

otro canal correspondería a una página web, la cual permitirá una relación más estrecha y personalizada con los posibles y futuros clientes. en esta se presentarán las principales funciones que tendrá educ-line, además de una sección de preguntas frecuentas con un chat en vivo. todo con un diseño ux, el cual corresponde a un formato amigable para el cliente.  cabe mencionar que en esta misma página puedes adquirir el servicio de educ-line cualquier segmente de cliente, 100% online. 

si un cliente ya tiene el servicio, tendrá una capacitación por videos que explique el funcionamiento de la plataforma. también para cualquier inconveniente habrá una mesa ayuda junto con una línea telefónica.  ",7.0
13220250.0,37.0,1508003.0,"los canales que queremos llegar a nuestros clientes es por medio principalmente en redes sociales, instagram , facebook, y el apoyo de la municipalidad de cunco, donde generamos
contenido, trabajáramos con un community manager para que podamos potenciar nuestras redes así llegar a nuestros clientes. trabajaremos en las redes anteriormente descritas ya que todas tiene un potencial rentable para nuestro proyecto. los canales que mas funcionan con mi segmento de negocio son las redes sociales y siendo estos los mas rentables para nosotros.",3.0
896750.0,37.0,377487.0,"segmento 1 
canal directo presencial , ya que necesito contacto directo con el cliente ( dueño y / o administradores ) de los establecimientos de alojamiento para presentar la combi y generar degustación y aportes del servicio en su empresa.

segmento 2 
directo  y presencial 
mediante reuniones con empresas de turismo y agencias que se dedican a trabajar el turismo de negocios.

segmento 3 
directo y presencial para generar lazos y etapas de la comercialización ",7.0
15400320.0,37.0,2516111.0,"existen diferentes formas para llegar al segmento de cliente:
redes sociales y medios de comunicación: sin duda es uno de los canales más efectivos que se utilizan hoy en día para alcanzar a los diferentes segmentos de clientes, plataformas como: instagram, facebook, pagina web (utilizar este medio no solo para dar a conocer la marca, sino que también generar ventas por medio del ecommerce), twitter, linkedin, tik tok, radios, e idealmente televisión. este último se busca utilizar en el futuro.
puntos de ventas físicos, como lo son: pub, bar, restaurantes, botillerías y supermercados.
ferias de negocios: la participación en ferias de negocios es el canal más rentable que los exportadores tienen para acceder a mercados extranjeros, incluso en esta era digital.
boca a boca: este canal siempre ayuda a alcanzar los diferentes segmentos de cliente, la recomendación del producto con el entorno personal, siempre brinda un potencial cliente/a.
flayer: el cual se distribuye en diferentes lugares de la región, como por ejemplo cabañas y/o hostales, donde se logra llegar a diferentes personas que visitan la localidad.
",5.0
9349320.0,37.0,277115.0,"1-matrimonios  o parejas entre 20 y 40 años 
por 
1- contactos de familiares y amistades:
1.2- boca a boca:
este segmento de clientes jóvenes y que se les puede dr información directamente y conocen de mi o tienen referencias
segmento que está obteniendo información y la divulga a su entorno
3- redes sociales(facebook, twitter, instagram, etc)
segmento de clientes de edades entre 20 y 50 años,contactos que van en aumento cada ves que s comparte la información con los demás contactos de cada uno traspasando información a quienes requieran obtenerla y tengan la necesidad del servicio.
   
4-  folletos repartidos en los distintos colegios cercanos, la comunidad y vía pública:
segmento de padres con hijos de enseñanza básica
segmento importante de clientes que si tienen una necesidad efectiva y se les presenta una alternativa de interés y que es una posibilidad concretar

5- radio local o de la comunidad
segmento generalizado que se espera informar de este servicio a la comunidad.

6- diario local o de la región
segmento de lectores que se informa sobre el servicio y sus beneficios  
7- pagina web
segmento importante de clientes que tiene la necesidad de este servicio y buscarían en ésta,  solucionar su problemática y obtener información actualizada de l servicio",7.0
5200050.0,37.0,605808.0,"los principales canales para llegar nuestros segmentos se constituyen de los siguientes:

canales físicos: casa, y dos puntos de ventas (negocios locales donde podemos exhibir publicidad y comercializar productos como tazones, poleras, artículos sublimados)
puntos de exhibición y comercialización, los simpson bazar y paquetería.
amasandería pasito a pancito, ambos ubicados en pichidegua

canales digitales.
contamos con fanspage, activo con publicación diarias de productos y servicios, también cuenta con tienda online. donde exhibimos todos los servicios de marketing digital, como lo son los planes de administración de redes sociales, diseño de logotipos, servicio de sublimación, tazones, corporativos y personalizados. cuenta de instagram activa y geolocalización en google map.
más ficha mi negocio en google, y blog en construcción.
de esta manera buscamos llegar a nuestros segmentos de consumidor prioritario y segundario utilizando herramientas gratuitas y de pago como lo son los anuncios en facebook e instagram.
",7.0
12283070.0,37.0,564270.0,"el canal principal es la aplicación móvil, en la cual se obtendrán todos los datos, todos los servicio, etc. es la principal fuente de acceso y conocimiento para los clientes",3.0
9398970.0,37.0,1538133.0,"la principal manera que tenemos de promocionar, vender e informar sobre nuestros productos, es a traves de redes sociales, ya que prácticamente todos nacen con un smartphone en sus manos, así como también de nuestra línea telefónica. también a futuro podemos incluir avisos en las radios como entrega de volantes.",3.0
15036450.0,37.0,1643726.0,"a través de redes sociales , radio y publicidad. 
redes sociales y publicidad tanto sea internet o visual física.
pagina web propia de la empresa con los ofrecimientos de los productos y canal directo de contacto vía chat, correo o teléfono. ",3.0
15086020.0,37.0,1618081.0,"bueno.

como ya dije por puestos de barrios punto fijo de venta contactar con verduderia establecidas 
citas o cartera de clientes a pedido .",3
8924360.0,37.0,1226437.0,"los canales a llegar son atravez de redes sociales tanto así  como facebook, instagram, whatsapp,afiches ,amistades ,familiares, en forma presencial o online. ",3.0
1700160.0,37.0,665700.0,por ahora sólo me recomiendan los mismos clientes a los cuales he realizado alguna obra,3.0
6214890.0,37.0,278748.0,mediante atencion personalizada y exposicion de mis articulos.,3.0
1741350.0,37.0,1730528.0,"1.- profesionales jóvenes 
2.- adultos mayores 
los canales de distribución para mis segmentos de clientes son como sigue: 

1.- con los profesionales jóvenes, ocupo mucho las redes sociales, wathsapp, facebook e instagram. he creado un grupo de wathsapp donde interactúo con ellos y manejo la agenda del centro. para ellos se hace más fácil de esta forma, pues todos, sin excepción cuentan con la tecnología para hacerlo. 

2.- con los adultos mayores, el trabajo es más boca a boca, algunos de ellos manejan wathsapp y facebook, donde también con ellos interactúo, el porcentaje de manejo de redes sociales en ellos es mucho menor.

como lo señalé, es más boca a boca y mucho llamado telefónico mediante el celular. además debo señalar que cada cierto tiempo (4 veces al año), les visito en sus centros, pues casi el 90% de ellos, pertenece a algún club de adulto mayor, donde les llevo información, les doy charlas gratuitas, que me permiten promocionar mi centro.
",7.0
12070020.0,37.0,2510982.0,"respecto a nuestro principal por canal por el cual llegamos a nuestros clientes hasta el momento ha el sido el presencial, a través de la recomendación de nuestros propios compradores los cuales validad el trabajo que se desarrolla y de esta forma logramos llegar a personas mayores que buscan un producto de exclusivo de calidad en el cual se le proporciona una gama de telas que tenemos y con las que podemos trabajar en su producto. por otro lado,  las redes sociales como facebook, instagram, twiter y whatsapp han sido fundamentales para la captación de clientes jóvenes y adultos, en esta misma línea mencionar que las redes han sido fundamental para el reconocimiento y perdurar en el tiempo.  por último es necesario implementación de una página web para captar la atención de empresas públicas y privadas ",3.0
7464670.0,37.0,1653156.0,"de acuerdo a la selección de mis segmentos de clientes, considero que deberíamos encontrarnos en todos los canales de comunicación que mejor funcionan, estos son: elaboración de folletería, que serán distribuidos en los locales comerciales de la capital de alto biobío (ralco), oficina de información y/o espacio de publicidad en las empresas privadas y públicas. pagina web, facebook, twitter, whatsapp, radios comunitarias y teléfono.",5.0
4164300.0,37.0,283509.0,"los canales de venta que se utilizarán para llegar a nuestros clientes es a través de manera presencial en nuestro local donde se pueden consumir nuestros productos y disfrutar de un agradable ambiente, también y como forma de publicidad por medio de redes sociales, principalmente facebook, correo electrónico e instagram, ya sea de manera gratuita o también con publicidad pagada, donde los clientes pueden consultar por nuestros servicios y productos, valores, realizar reservaciones, etc. 
para mi segmento de clientes los canales que funcionan mejor son efectivamente las redes sociales, ya que son ocupadas por estos de manera frecuente durante el transcurso del día, de esta manera es más fácil, rápido y efectivo llegar a ellos que con otros medios, además la información relacionada a los servicios y productos estará siendo constantemente actualizada.
el canal mas rentable de mi proyecto es el presencial, ya que a través de este los clientes viven la experiencia de disfrutar de un producto de excelente calidad en un espacio que entrega todas las comodidades para disfrutarlo, por otra parte, estando en nuestro local pueden conocer los procesos de producción, compartir y conocer experiencias relacionadas a cocina que he adquirido a través del tiempo en viajes alrededor del mundo.
",3.0
12129710.0,37.0,1332283.0,"para llegar a mis clientes aplicare las mismas estrategias que me han dado resultado en con mi emprendimiento actual “mimi nails”entre ellas:

1-inversión en plataformas digitales como instagram, facebook y página web 

2-la buena atención al cliente ya que una de las maneras más efectivas de fidelizarlo es la recomendación directa desde la experiencia propia  de otro que ya adquirió el servicio, sintiéndose conforme , de esta manera utilizamos al mismo cliente como un promotor o influencer de la marca

3- en tercer lugar la estrategia con gente popular o los llamados “influencer” para llegar a clientes de otras comunidades de la región  ",5.0
12422370.0,37.0,679707.0,"mis canales para llegar a mis clientes debiera ser presencial, es decir con una buena puesta en escena de mis producto, en supermercados y similares y con una pagina web es decir de presentación virtual para ofrecer y vender mis hongos comestibles. mis canales mas rentables con el presencial y para futuros clientes la pagina web.",5.0
8916810.0,37.0,1707459.0,"para el caso de la linea de polinización; el canal es presencial, reuniones , visitas a terreno etc
en cuanto a la linea  comercializaciòn de miel, el canal de venta es virtual; internet redes sociales, pàgina web, etc, entendiendo el contexto de pandemia por el que estamos viviendo se hace más necesario profundizar en la digitalización del negocio, lo que es parte de nuestros objetivos en el corto plazo.",7.0
12271950.0,37.0,356097.0,"el principal canal será la venta presencial, directamente en cada establecimiento educacional, que servirá de nexo con nuestro usuario final.
adicionalmente se utilizarán las redes sociales, en particular instagram y facebook, para la difusión de los talleres y cursos de capacitación que ofrecerá nuestro centro.
también se contempla el uso de una página web propia, para que las personas se puedan informar de nuestros servicios, y puedan inscribirse en nuestras actividades, o bien reservar alguna hora de atención.
además se habilitará una casilla de correo electrónico, para la comunicación formal con establecimientos educacionales, responder dudas de los usuarios, saludarlos en su cumpleaños y fechas importantes, y para compartir material que pueda ser de su interés.
adicionalmente se dispondrá de una línea telefónica móvil para la reserva de horas de atención psicológica y servicios de post-venta.",7.0
2154630.0,37.0,1590481.0,"de acuerdo al segmento de clientes de mar y cielo, nuestros principales canales de venta son instagram, facebook, sitio web, tienda física y captador de clientes en terreno.
sin embargo estos son nuestros canales de ventas actuales  y estamos consientes de que en el futuro, esto podría modificarse de acuerdo al comportamiento del mercado, nuevas plataformas digitales y de difusión.",3.0
11378360.0,37.0,1369060.0,"para el primer segmento de clientes (kidults)será a través de medios como lo son facebook e instagram ( redes sociales en general o pagina web de compras) ya que el publico objetivo se maneja con lo ultimo en tecnología. y las compras cada día son mas online y de manera menos presencial.
para el segundo segmento (el fandom antes ya mencionado) ya que es un publico mas juvenil se montaran \stand\"" (es una caseta o puesto en un evento en particular o eventos) esto con el fin de presentar los productos de una forma mas directa a un publico que se reúne en eventos de la fanaticada tales como expogame, fanatic, comicon, por mencionar a los mas importantes exponentes del genero; cabe recalcar que esto nunca se ha hecho por alguna industria similar, siendo pioneros en este rubro y publico. además por supuesto de bombardear a los mas jóvenes a través de las redes sociales, que es lo mas frecuentado por este target.""",7.0
15240630.0,37.0,1482611.0,"quiero promocionar y difundir mis productos mediante la radio y canales digitales, ya que mi segmento de publico es ahi donde encuentran la informacion",3.0
15068040.0,37.0,1704561.0,"a través de los canales de redes sociales , propaganda , y presencial 
los  canales que mejor me funcionan son las redes sociales al entregar servicio delivery 
y presencial los canales mas rentables son las redes sociales , entrega de folletos ,publicidad, puerta a puerta 
",3.0
15196810.0,37.0,1482657.0,"a través de redes sociales, letreros dentro de los negocios, el llamado voz a voz, entre otros.

el canal que funciona mejor es a través de las redes sociales, ya que estamos en un mundo tecnólogo donde todo se conoce por las rrss. el sistema empleado para promocionar la marca es a través de publicidad, esta publicidad suma tanto a la marca como al negocio que participa de esta idea, ya que, dentro de la publicidad se mencionaran los puntos de compra afiliados a nuestro modelo de negocio.

los canales mas rentables, como antes lo mencionaba, son el voz a voz y a través de publicidad mutua en rrss. darnos a conocer por nuestras ventajas y satisfacción que concedemos.

",3.0
