postulante_id,pregunta_id,respuesta_id,texto.respuesta,nota
4323400.0,37.0,1369612.0,"respecto de los canales de comercialización en el caso de clientes personas naturales trabajare con una red de faceboock que me permitira ofrecer mis productos a través de una fan page que me permitira atomizar la busqueda delimitando rangos etarios, ingresos, ubicación, entre otros. de igual forma para el acceso hacia las diseñadoras espero generar una segunda fanpage de modo de llegar al segmento de diseñadoras que trabajan en la zona oriente de la región metropolitana, incluyendo comunas como las condes, lo barnechea, vitacura, entre otras. he definido ambos canales de comercialización en ambos segmentos, pues el canal de sala de ventas no es posible pues vivo actualmente en un  pueblo cordillerano con bajo nivel de ingresos y población, mi ventaja comparativa al tener mi emprendimiento en esta comuna es el bajo costo de los arriendos y de facil y bajo costo de insumos madera, lo que me permitira tener mejores margenes ",7.0
12065100.0,37.0,305957.0,"me gustaría llegar a los clientes a través de publicidad en redes sociales, radio local, periódico, con la asesoría técnica que ello requiera, pensando en abordar a clientes con edades que fluctúen desde los 14 años hacia adelante. ",3.0
14646770.0,37.0,1419338.0,"los canales mas apropiados son facebook e instagram como un único grupo, tik tok, comercios especializados con enfoque en cuidado del organismo y el medio ambiente, interesados en trabajar con nuestros productos ya sea para consumo o formato para regalo. además de ello contar con pagina web.
nuestros productos se harán llegar por despacho propio lo cual permitirá cumplir con las exigencias de rapidez y compromiso con nuestros clientes, contando con todas las normas sanitarias que exige la normativa en chile y otros paises
los canales mas rentables para nosotros son los digitales",3.0
4881910.0,37.0,379603.0,"a través de qué canales quiero llegar a mis clientes? la miel estará disponible en los canales de distribucion en ferias costumbristas locales y regionales, pabellon del amor araucania, minimarket locales, restaurantes de freire y en su local de venta propio ubicado en la localidad rural de rucahue quepe.

 ¿cuáles son los canales que funcionan mejor para mi/s segmento/s de clientes? ferias costumbristas, minimarket y sala de venta propia. 

¿cuáles son los canales más rentables de mi modelo de negocio? ferias costumbristas y exposiciones.",3.0
13967740.0,37.0,1368968.0,"kumelkan llega a sus clientes de 25 a 35 años por redes sociales como instagram, y al segmento de 35 a 50 años por whatsapp y facebook al segmento de dueñas de casa llegamos a través de una experiencia que hayan vivido con nuestro producto en alguna actividad familiar donde el segmento anterior llevo el pan sabroso y saludable. además de medios masivos de comunicación como la radio, con el que pretendemos llegar a otros segmentos. participación de ferias saludables y la generación de tarjetas de presentación para llegar a un mercado mas amplio. en virtud del covid, también llegamos a nuestros clientes mediante delivery con una empresa formalizada. ",7.0
9918490.0,37.0,1297622.0,"mercado libre, facebook, whastapp, quiero crear un apagina web.
amigos en ferias libres.",1.0
8099680.0,37.0,1790512.0,"a nuestro segmento a, que es el mas rentable, nos aproximaremos por el metodo de venta directa, son los mas rentables, ya que, al tener mas poder economico,  y necesidad de servicios mas amploos, podra optar a paquetes de mas valor y mayor precio, son el segmento que mas necesita estos servicios. el trato tiene que ser directo, los administradores y dueños de estas empresas son generaciones x y boomers, que entienden la necesidad de utilizar la tecnologia, pero la desconocen y no son nativos de estas.
llegaremos al segundo segmento de forma virtual al comienzo, generando en el cliente el conocimiento de nuestra marca, para luego, cerrar la venta. publicidad pagada en redes solciales como facebook e instagram sera la fomra mas eficaz ya que estas aplicaciones tienen un gran alcance.",7.0
1511430.0,37.0,1542871.0,"
la venta para este negocio se puede hacer de manera directa, o mediante una reserva por correo electrónico, al igual que directamente desde nuestro sitio web.

en el caso de que nuestros clientes sean instituciones o empresas, el pago por estos servicios se podrá efectuar en efectivo o mediante cualquier medio de pago con un plazo máximo de crédito a 30 días, en el caso de que los clientes sean personas particulares, el pago por este servicio sera en efectivo o con tarjeta de débito, con un plazo máximo de pago de 7 días.

forma parte importante en este proyecto la realización de un
plan de marketing, por lo que es esencial, el poder contar con una pagina web que incluya una especie de tienda en linea, para que por este medio puedan hacer sus reservaciones o consultas.",3.0
12252230.0,37.0,378131.0,"con una penetración regional del 82% el medio internet es la mejor opción para comunicación con nuestro go. 

los canales de comunicación primarios serán, facebook, instagram (72% de penetración regional en el go), plataformas que nos ayudan a generar contenidos tanto orgánicos como en la plataforma ads con la cual buscaremos generar comunidades para compartir contenido con nuestro go. 

además, completamos con información con publi rreportajes en medios digitales asociados, los cuales también será viralizados a través de nuestras rrss
con testimoniales presenciales (videos) buscaremos reforzar las necesidades de conocimiento e información del producto, con el fin de satisfacer las necesidades del cliente en cuento a usabilidad del producto. 
",3.0
6271700.0,37.0,2514064.0,"clientes existentes: mediante comunicación directa. por llamada telefónica o vía aplicaciones de mensajería instantánea (whatsapp. instagram, facebook). ya que gracias a estos métodos directos podemos llegar a concretar fácilmente una venta de productos asociada a un servicio. clientes
nuevos: queremos llegar de la forma más directa, a cada uno de nuestros futuros clientes, mediante el marketing digital pagado (redes sociales), método de fidelización de clientes, con correos masivos de campañas (tipo oferta, promociones, etc.). y por el método de contacto de persona a persona que sería nuestro canal más rentable. entregando así, una oferta y/o promoción más personalizada, para cada nuevo cliente.",3.0
348150.0,37.0,1396062.0,"loa canales para llegar a mis clientes son las redes sociales, el boca a boca y un taller donde el cliente pueda apreciar el producto y su proceso de creación.",3.0
15056030.0,37.0,1396476.0,"los canales de comunicación, comercialización y distribución que utilizamos son:

para: 1.- personas, niveles socioeconómicos c2 y abc1, a nivel nacional, rango etareo de 27 a 55 años, que consumen aguas purificadas por sus beneficios en la salud, utilizaremos:

a) redes sociales, instagram y facebook, posicionamiento natural y campañas pagadas b) campañas de google adwords c) email marketing d) reparto a domicilio

para 2.- distribuidores de agua purificada a nivel regional y nacional. micro y pequeñas empresas que realizan distribución domiciliaria de agua purificada utilizaremos:

a) venta directa b) despacho a regiones c) email marketing d) campañas pagadas de google adwords",7.0
10460270.0,37.0,618665.0,"mi segmento de mercado se basa en mujeres desde los 25 años  hasta los 45 años de edad, por ende  a través de diferentes canales, como marketing digital, redes sociales (instagram y facebook),llegar a ser fanquicia,página web y poder generar un desarrollo de marca y posicionamiento en el mercado (rr.ss, tarjetas de presentación,generar convenios, etc), básicamente una estrategia de marketing mas potente generando interés en mi público objetivo. ",5.0
10694860.0,37.0,605647.0,"entregar una buena relación precio calidad, debido a la implementación de procesos de mejoramiento continuo, herramientas modernas de gestión y herramientas modernas de información capaces de mantener bases de datos de calidad y la posibilidad de poder estar conectado online en forma permanente con nuestros clientes.",3.0
3222400.0,37.0,1811212.0,"-a los jóvenes y adultos trabajadores, llegaremos a través de redes sociales, boca a boca y página web con carro de compra.
-a los negocios de barrio llegaremos por medio del boca a boca, visita en terreno a presentarles la propuesta de valor
",7.0
14989100.0,37.0,1582178.0,"los principales canales a utilizar para llegar a nuestros clientes seràn por vìa digital, dando énfasis para la difusiòn las redes sociales (instagram, facebook, pinterest). 
el canal de venta serà una pagina web permanentemente actualizada y enlazada a nuestras redes sociales, la cual contarà con un carrito de compra que facilite los medios de pago web.
para atenciòn y coordinaciòn con el cliente se utilizarà mensajerìa directa por medio de whatsapp, mensajerìa de redes sociales y telèfono. ",3.0
4352900.0,37.0,1635308.0,"a través de canales presenciales y digitales.
los canales digitales son los que llegarán más a los clientes una página de facebook especializada en el taller. 
los más rentables serán los digitales.
",1.0
939920.0,37.0,1332996.0,"los canales que quiero usar para llegar a mis clientes son medios digitales como las redes sociales que lleven a los potenciales clientes a una página web formalizada para que podamos canalizar las dudas y preguntas por un medio establecido. sin embargo, las redes sociales serán el principal medio de promoción y transferencia de la empresa. otra forma es promocionarnos en las páginas donde las familias buscan información sobre terapias y formas de estimulación para sus hijos. además, pensamos promocionarnos dentro de los centros de terapias y fundaciones de nuestra región para que los padres que asisten sepan que pueden encontrarnos fácilmente.
los canales que funcionan mejor son las redes sociales a nivel nacional y además la información entregada presencialmente en los centros de terapias y fundaciones, así como escuelas de nuestra región. ",7.0
9942200.0,37.0,259865.0,"mis canales son las redes sociales como facebook, instagram y wahtsapp, los contactos de conocidos los cuales me recomiendan a traves del boca a boca , las paginas de compra y venta de productos existentes en el mercado nacional. el principal canal son las redes sociales a las cuales accedo en forma gratuita y me permite llegar a muchos lugares, de donde puedo captar nuevos clientes.  ",3.0
15301720.0,37.0,1807141.0,"
basado en el mkt digital, tendremos habilitado el e-commerce en nuestra web y que este sea pagado por webpay, agilizando la experiencia de acceder a productos naturales a través de nuestros canales web.

para quienes no están familiarizados con esto, tendremos la opción de acceder a los productos vía instagram y depósito (transferencia) con despacho a domicilio.",3.0
12443030.0,37.0,639112.0,"a través de los canales mas utilizados hoy, como lo son las redes sociales, es como quiero llegar a mis clientes. no dejando de lado publicidad clásica, mediante folletos, visitas por recomendaciones a futuros clientes, mostrando fotografías de los productos ya entregados, como ejemplo.",5.0
7030100.0,37.0,243190.0,"se utilizarán dos canales principalmente, los cuales van relacionados secuencialmente uno después de otro.
en primera instancia se utilizará un canal virtual, mediante sitio web y publicidad online dirigida, para promocionar las bondades que ofrece vive melado y atraer clientes.
en una segunda instancia se utilizará un canal presencial, en donde ya definitivamente se captará al cliente y se le ofrecerán servicios complementarios relacionados.",5.0
10508240.0,37.0,1190925.0,"principalmente redes sociales y radios y tv 

facebook 
instagram
desde niños adultos adulto joven 

a la vez propaganda en radios y tv para adultos mayores ",3.0
11452960.0,37.0,1497446.0,"espero llegar a mis clientes a través de publicidad en redes sociales, mediante la creación de una pagina web para promocionar el producto, publicidad estática y recomendaciones.
los canales que mejor funcionan son la publicidad en redes sociales y las recomendaciones. los canales mas rentables serian la publicidad en redes sociales y las recomendaciones.",3.0
11055550.0,37.0,1228829.0,"considerando el cohorte, se utilizarán inicialmente canales de comunicación tradicionales para este tipo de cliente early adopter (whatsapp business, llamadas, facebook, instagram, mail) y canales de distribución del mismo tipo (google maps, y los mencionados). en conjunto se planifica la creación de página web que permita mayores facilidades para el acercamiento y reserva, pago electrónico, etc.",5.0
693030.0,37.0,285924.0,"coffe co, producciones tendrá los siguientes canales de distribución y ventas según nuestro segmento de clientes:
1.- para el segmento de empresa se comercializará a través de dos canales directos: a.- fuerza de ventas de la empresa principalmente basado en llamadas telefónica y oferta por correo, utilizando estos medios para entrar en contacto con potenciales clientes y comercializar nuestros servicios, vender o programar la conversación personal, a modo de mantener contacto fluido con nuestros clientes o potenciales clientes.  b.- pagina web de la empresa con comercio electrónico, donde el cliente tendrá la opción de elegir su menú y servicio, desde un catálogo en línea o pedir que un ejecutivo le contacte para atender su solicitud. 
además, se tendrá un canal indirecto de venta y distribución a través de los centros de eventos, salones o establecimientos que arrienden sus locaciones para distinto tipo de eventos, pero que no entreguen el servicio de catering o coffee break, estos ofrecerán nuestros servicios, a cambio de un porcentaje a modo de comisión, o por algún convenio que beneficie a ambas empresas. 
 2.-para el segmento de instituciones y municipios se dispondrá de un canal directo de venta y distribución, la fuerza de ventas será la encargada de licitar a través del portal de mercado público los servicios de coffee break, además mantendrá una comunicación  permanente con las instituciones, a fin de licitar  a través de  contratos privados, fundamentado esto en la particularidad del servicio que se ofrece, lo que  da la libertad a los organismos públicos  de contratar nuestros servicios e invitarnos a licitaciones privadas. 

por otra parte, la empresa dispondrá de canales de información, evaluación y postventa el que será principalmente de la página web de la empresa y redes sociales de la empresa. a través de estos medios se darán a conocer las ofertas de menús de los diferentes catering y coffe break, como también las diferentes posibilidades de ornamentación y personalización. además de promociones, y nuevas alternativas en menús, ambientaciones y nuevos coffee break temáticos (se renovarán permanentemente para ir de mano con los temas actuales, y para disponer de un gran abanico de posibilidades para nuestros clientes)
",7.0
9403070.0,37.0,1145763.0,"llegamos a nuestros clientes a través de los canales virtuales debido a que mis segmentos de clientes son de una edad relativamente joven. el canal presencial es usado de forma ocasional con algunos clientes en casos puntuales( el no uso de las plataformas virtuales).
los canales mas rentables para mi modelo de negocio son los virtuales. ",3.0
13839540.0,37.0,1431160.0,"utilizaremos 3 canales de difusión para poder llegar a la mayor cantidad de personas de nuestro público objetivo, estos serán: facebook, instagram y una página web propia. dada las condiciones sanitarias del país tenemos que ser objetivas y apuntar a los medios a los que puede acceder fácilmente la gente hoy en día. en las redes sociales realizaremos mensualmente campañas publicitarias pagadas para aumentar el número de seguidores y así promocionar nuestro servicio a más personas.

respecto de los canales de pago, utilizaremos las opciones de transferencia electrónica y botón de pago en la página web (webpay o similar), con lo que las personas podrán pagar tanto con tarjetas de débito o crédito. además de que son los medios de pago más utilizados actualmente.

para los canales de distribución, todos nuestros desayunos son entregados a domicilio en las comunas de buin, paine y alrededores. para esto utilizaremos movilización propia, y también subcontrataremos el servicio a personas de buin que realicen delivery, para fortalecer la economía local de la comuna y apoyar a otros emprendedores y pymes.  
",3.0
14878610.0,37.0,1297530.0,"ya que va dirigido a emprendedores queremos manejar los canales tecnológicos, las redes sociales ya que es lo más utilizados por ellos. y lo más sano para todos para evitar reuniones y contacto preferimos correos electrónico o redes sociales",5.0
13099990.0,37.0,1350775.0,"los canales de comunicación, comercialización y distribución que utilizamos son: 

para 1.- grandes empresas que certificadoras de instalaciones de gas en la región de valparaíso que requieren ejecutar inspecciones a través de subcontratos, ofrecemos servicio de inspección técnica certificada en modalidad subcontrato utilizaremos:

a) gestión de licitaciones privadas b) campañas de google adwords c) email marketing d) mercado público e) campañas altamente segmentadas en linkedin f) venta directa corporativa

para 2.- medianas empresas que requieren implementar sistemas industriales que requieren instalaciones de gas, ofrecemos servicio de instalación de sistemas industriales de gas utilizaremos:

a) gestión de licitaciones privadas b) campañas de google adwords c) email marketing d) mercado público e) campañas altamente segmentadas en linkedin f) venta directa corporativa",7.0
892720.0,37.0,1772825.0,"difusión mediante instagram, facebok",3.0
3271930.0,37.0,1714152.0,"sitio web y redes sociales, por cadena de referencias, por reuniones y visitas a terreno",3.0
10876070.0,37.0,273780.0,"para llegar a nuestros clientes, usaremos los siguientes canales;  teléfono; whatsapp, instagram; facebook, los canales que funcionan mejor son; whatsapp y teléfono, los canales mas rentables son el whatsapp, con un 90% y teléfono con un 10 %

canal físico: la mejora del canal físico que nos permita poder atender a las personas directamente y que puedan siempre llevarse la mejor experiencia de atención

otros canales: por medio de la distribución a otros puntos, pensamos llegar a mas clientes por medio de canales externos de  venta donde podamos llegar con nuestra marca",3.0
7077410.0,37.0,1281154.0,"para el primer segmento de cliente correspondiente a pymes, quienes están más familiarizados con las redes sociales, ya que se promocionan y venden por este medio. el canal será las redes sociales a través de nuestros perfiles de facebook e instagram, en donde tendremos publicaciones de las funcionalidades del equipo, de toda la propuesta de valor, promociones y casos de éxitos, para transmitir confianza al cliente del tipo pyme. dado que el 30% del comercio electrónico se realiza a través de mercadolibre y las pymes están muy presentes en este medio, también realizaremos publicaciones de venta de nuestro producto en este marketplace, y aprovecharemos la confianza que entrega mercadolibre, para que las pymes que están familiarizadas con ese sistema también se sientan confiadas a comprar. en mercadolibre tendremos distintos tipos de publicaciones, en que la opción más básica del equipo, que permite una menor cantidad de trabajadores activos se ofrecerá a un menor precio, con le fin de acomodarnos a las necesidades del cliente, es por esto que para una pequeña empresa con 5 trabajadores puede adquirir un equipo a un menor costo, el que puede más adelante pagar adicional 50.000 para administrar a 250 trabajadores. se pagará publicaciones premium y clásicas para tener más ofertas a la pyme, en que pueda pagar hasta en 6 o 12 cuotas. el pagar por el posicionamiento en mercadolibre (a través de comisiones) y pagar campañas de facebook resulta rentable para el tipo de segmento, quien es un miembro activo de estos canales.

para el segundo segmento de cliente, que son las entidades sin fines de lucro, llegaremos a ellas a través de las búsquedas de google. nuestra página tiene un contenido orgánico en que posiciona de buena manera las palabras calves como: reloj asistencia, control asistencia, reloj certificado, etc). a demás se potenciará este canal realizando pagos a google adsense para que posicione de mejor forma nuestra página. de esta manera atraeremos flujo de usuarios a nuestra plataforma relojsimple.cl, para informarles los beneficios tanto técnicos como económicos de nuestra propuesta. a demás de estas plataformas tecnologcias, tendremos a disposición el correo de la empresa, que permitirá realizar cotizaciones formales, acordar detalles de la prestación del equipo, canalizar la forma de pago, etc. para este segmento también tendremos disponible un teléfono de contacto, para poder canalizar las inquietudes de nuestro producto. el pagar por traer publico objetivo a mi página, es rentable para este segmento, ya que se invierte en la captación, y solo se incurre en el gasto del medio de pago si elige transbank, y no en un costo por la venta.
",7.0
7071230.0,37.0,1644278.0,"los canales de comercialización para ambos segmentos  sera 1.  presencial, en el galpon cervecero atenderemos a nuestros clientes para que puedan degustar y elegir la cerveza que mas les guste. 2. redes sociales,  fanpage de facebook e instagram promocionar las cerveza artesanales y todos los productos relacionados con la cerveza y hacer concursos para fidelizar a nuestros clientes. 
el canal de distribución sera retiro en local, en el caso de los clientes que se presenten el forma presencial al galpon cervecero y tambien tendremos distribucion a domicilio, ya que tendremos servicio de delivery para llegar hasta la puerta de nuestros clientes. ",7.0
12951540.0,37.0,1537213.0,"el canal principal para darse a conocer será el online, a través de las redes sociales como instagram, tiktok, facebook, y plataformas como youtube, además de la realización de un podcast que se transmitirá vía spotify y que tiene como objetivo hablar de temas relacionados a lo cultural dentro de nuestra comunidad, reforzando el mercado artístico de la comuna. también esta la posibilidad de publicitar el proyecto de manera local por medio de artistas, radio, y panfletos. la idea de estos canales es utilizarlos de manera constante y tener una publicidad persistente en las redes sociales.

el canal de compra también será online y se enviara vía correo o cualquier plataforma de internet.
",3.0
8658700.0,37.0,600173.0,"encontramos que los canales de comunicación que funcionan mas sera facebook, instangram, entre otro. ademas le queremos brindar a los clientes el servicio del café mas su toque casero de sándwich, y pasteles hecho en casa.
los canales mas rentables de nuestros servicios serán las redes sociales puesto que no implica tanto costo,;esto sera un costo personal en la difusión de el negocio. ",3.0
15017910.0,37.0,1551335.0,"los  canales por los cuales quiero llegar a mis clientes son : redes sociales ( instagram), llamada telefónica y presencial.
los canales que funcionan que funcionan mejor para mi segmento de clientes son :
- redes sociales: desde los 16 años hasta el adulto.( los adolescentes y adultos tienen mas dominio sobre la tecnología)
- llamada telefónica: desde los 16 años hasta el adulto.( los adolescentes y adultos tienen mas conocimiento para saber usar un teléfono y así llamar a través de el)
- presencial: desde los 14 años hasta el adulto mayor.( en niños menores de edad y adultos mayor para una atención mas segura y eficaz)
mis canales mas rentables para mi modelo de negocio son: redes sociales (instagram) y presencial para mas comodidad al adulto mayor, de todas las formas el cliente tendrá un buen servicio al momento de ser atendido, respondiéndoles todas las dudas necesarias para así al momento de hacer su compra este totalmente conforme con ella.",7.0
15189200.0,37.0,1488499.0,"de manera física, digital, telefónica.
mis canales mas rentables son los digitales",3.0
14930330.0,37.0,1222366.0,"folletos, por whatsap, por facebook, por instagram",3.0
6114930.0,37.0,1482772.0,"todo lo que sea marketing digital sin duda es el mejor medio de difusión para mi modelo de negocio. 
para mi segmento de clientes sin dudas las rrss, pagina web, whatsapp, correo electrónico, serian el mejor medio, pudiendo entregar mediante ellos todas las características, imágenes y cotizaciones de los productos que ofrecemos.",3.0
12131670.0,37.0,394829.0,"¿a través de qué canales quiero llegar a mis clientes?
nuestro canal de comunicación serán: radio, diario, emails, redes sociales.
¿cuáles son los canales que funcionan mejor para mi/s segmento/s de clientes?
la internet general, como por ejemplo nuestra pagina web
¿cuáles son los canales más rentables de mi modelo de negocio?
redes sociales
",3.0
5044020.0,37.0,1320875.0,"los principales canales a través de los cuales, quiero llegar a mis clientes son los siguientes:

1.- redes sociales: publicaciones a través de facebook, whatsapp.

3.- marketing táctico: impresiones de afiches y artículos de promoción y publicidad.

4.- face to face: a través de recomendaciones del boca a boca.
",1.0
