postulante_id,pregunta_id,respuesta_id,texto.respuesta,nota
11735140.0,18.0,1336217.0,"la relación con los clientes es clave, buscamos fidelización y relaciones de largo plazo basadas en la buena experiencia, confianza y cercanía con todos nuestros grupos de interés. además, somos facilitadores de la comunicación, para esto tenemos disponibles los canales mencionados en el punto anterior. es importante tener claro que cada cliente exige un canal de comunicación diferente. por ejemplo las personas entre 25 y 35 son activos usuarios de rrss y utilizan bastante este medio para la comunicación, para tener respuesta inmediata es importante tener un community manager en el equipo capaz de responder los mensajes, informar y/o resolver lo antes posible o al menos derivar los mensajes a canales de comunicación personales como whatsapp. por otro lado, la mantención y administración web y google ads también debe ser administrados por un especialista a fin de lograr el posicionamiento esperado en este canal y que el funcionamiento de la web cumpla con las expectativas planteadas. además, el marketing directo generado a través del correo electrónico es administrado por gerencia (o sea yo), sin embargo todo eso es una inversión en tiempo y recursos que suplen no tener oficina física, de hecho sumando todos estos costos no superan el costo de arriendo más mantención de una oficina física. nuestra atención es virtual pero personalizada y cercana, mas al momento de la entrega del producto o servicio, nuestra atención marca la diferencia y cierra el lazo de cercanía que buscamos. hay otros usuarios mas tradicionales que usan vía telefónica y whatsapp, para este punto es clave contar con planes móviles para responder a esta necesidad.
nos preocupamos de los clientes sus gustos, preferencias y formas de pago (en este caso efectivo, transferencia, crédito, débito, es importante habilitar sistema de pago).
",7.0
9013080.0,18.0,331258.0,"producto software para instituciones/ software para docentes
servicios mantención y actualizaciones/ capacitación (inducción) para docentes y usuarios en general.
con el segmento de clientes correspondiente a personas jurídicas sostenedoras de instituciones educativas la relación se mantendrá personal desde la primera reunión de presentación de productos y servicios hasta el proceso de mantención y actualización de los mismos. de esta forma se busca fidelizar a este segmento a través de una trato personalizado a cargo de un ejecutivo de ventas al cual puedan acudir cuando lo requieran. buscamos generar la sensación de que neatic se adapta a las necesidades de cada institución. el costo asociado a esta relación será el pago de honorarios para ejecutivos de venta, transporte de los mismos, telefonía e internet.
el segmento de clientes correspondiente a personas naturales que usan nuestras aplicaciones se mantendrá una relación automática a través de la aplicación y la página web de neatic donde podrán encontrar la sección de preguntas frecuentes y la opción de contacto directo con ventas o servicio técnico. además, ambos segmentos de clientes, se mantendrán informados sobre las actualizaciones de los softwares y aplicaciones a través de mailing. los costos asociados a esta relación serán pago de honorarios de un ejecutivo de ventas telefónico, técnico telefónico, mantención de la página web y servicio de mailing.
",7.0
6317100.0,18.0,302370.0,"nuestra relacion es sercana amena y de respeto, se les recibe en mi casa en donde ellos comodamente escogen y eligen las telas y los materiales para su producto.
tenemos la costumbre de monitorear nuestros trabajos y asi valer por el buen funcionamiento de nuestro cortinaje, al ser ameno nuestro trato ganamos buenos clientes atraves de la recomendacion.
el mismo trato se les ofrece a las personas representante de alguna institucion o empresa por sobre todo nuestro trabajo tiene como valor agragado el buen trato y servicio. ",3.0
10485730.0,18.0,1565527.0,"la relación con los clientes del canal online será centrada en la experiencia del usuario a través de la plataforma. poder hacer seguimiento del resultado de su receta de cerveza , recomendaciones y oportunidades de mejora generara una fidelización con el cliente. 
en el caso de los clientes del canal offlline  la relación será presencial y directa entendiendo que se debe educar al cliente final de este nuevo proceso para realizar cerveza en casa. al tener una alianza con una empresa australiana los márgenes para este canal b2b seguirán siendo atractivos alrededor de un 20%.  
",3.0
12302940.0,18.0,422545.0,"la relacion que espero tener con cada segmento de clientes es directa y personalizada , buena atencion. el costo para mi restorant es  contratar una persona encargada de la cocina  y capacitarla en marketing .",3.0
11911980.0,18.0,318217.0,"esperamos tener una relación cercana con nuestros clientes y potenciales clientes, dando a conocer a represent por un excelente servicio al consumidor, el costo asociado a mantener una plataforma online y redes sociales es bajo-medio, debido a que los contenidos que se suban a nuestras redes sociales sera creado por nosotros y los costos asociados a esto son bajos.",3.0
7183200.0,18.0,1253394.0,"i- una relación en el proceso de pre venta , venta y pos venta donde se mantenga la comunicación con ellos , los canales de comunicación serán vía redes sociales facebok , watsap , instagram , correos electrónicos , vía telefónica . 

1.-grandes empresas mantendré un contacto periódico mediante correos electrónicos , llamados telefónicos , visitas a sus empresas ,envió de promociones personalizadas..

 2.-mediana y pequeñas empresas mantendré un contacto periódico mediante correos electrónicos , llamados telefónicos , envió de promociones personalizadas . 

3.- instituciones publicas
la relación sera en los procesos de pre venta , venta y pos venta de carácter formal mediante correos electrónicos y pagina web . 

4.- turistas nacionales e internacionales
mantendré un contacto permanente vía redes sociales , pagina web , contacto telefónico.
 ii- los costos de relacionarme con los clientes serán. 
1.-los costos de
relación con la gran empresa estos serian gastos de uso de teléfono , gastos de consumo de internet. ademas del sueldo de la persona encargada de relaciones publicas de la empresa 

2.-los costos de relación con la micro y pequeña empresa
empresa estos serian gastos de uso de teléfono , gastos de consumo de internet , gastos en promisiones merchandising. ademas del sueldo de la persona encargada de relaciones publicas de la empresa. 

3- los costos de relacionarme con instituciones publicas serian principalmente gastos en pagina web y gastos de internet y telefono ademas del sueldo del encargado de relaciones publicas de la empresa 

3.-los costos de relacionarme y mantener el contacto con turistas en general serian principalmente los costos de inversión en afiches , gastos de internet , promociones .pagos de pagina web",7.0
10877750.0,18.0,388827.0,"restaurantes y botillerías: para ambos segmentos la relación sera tanto personal como a  distancia, la primera  se realizara cada vez que hacemos las entregas de productos que tedran una periodicidad semanal o acordes a las necesidades del cliente. sus costos son menores ya que no se destinarán recursos especiales para mantener esta relación, sino la misma que usamos para la distribución.  
a distancia será una relación muy útil, ya que nos permite, establecer comunicación primordial en cuanto a el intercambio y respaldo de documentos legales a través de correo electrónico. información respecto a precios por cantidades, renovación de equipamiento, fotografías de procesos, publicidad de la empresa, nuevos estilos de cerveza, nuevas capacitaciones o certificaciones de la empresa, maquinaria adquirida todo esto con la finalidad de fortalecer la confianza y lazos creados.

asistentes a fiestas costumbristas: la relación con estos clientes sera personal, directa, cara a cara y se representará en el momento en que se produce el contacto vendedor-comprador. asi también tendremos una relación de acompañamiento y seguimiento a distancia orientada principalmente por redes sociales, y se medirá por los comentarios, likes, veces compartidas, y se mantendrá en el tiempo mediante constante actualización de información respecto a nuestros precios, lugares donde pueden encontrarnos, promociones, concursos online, fiestas a las que asistimos, calendario de ferias y fiestas costumbristas, reconocimientos entre otras. los costos monetarios de mantener esta relación es menor ya que las redes sociales son gratuitas y solo se asume el pago de internet, lo cual hoy en día es accesible para cualquier persona. a este nivel de desarrollo del negocio, no necesitamos contrataciones para estos ítemes.

",7.0
7543970.0,18.0,326083.0,"para poder clasificar el mercado potencial se debe, en primer lugar, realizar una segmentación multi atributos que involucre diferentes tipos de variables de segmentación con el objetivo de identificar grupos objetivos más pequeños y mejor definidos. las variables que se han tomado en cuenta para esta segmentación tienen principal relación con el juicio experto de los dueños de la empresa, los cuales han podido conocer el mercado durante los años previos, pudiendo diferenciar cuales son los segmentos más atractivos y que están dispuestos a contactar a la empresa.
variables geográficas:
1)	zona de residencia: se reconoce que el desarrollo del negocio tendrá diferentes costos según la estrategia que adopte en relación a la plaza del negocio. el negocio solo se desarrollará en tres ciudades de la región de coquimbo, estas son: ovalle, la serena, coquimbo, vicuña, los vilos, salamanca, illapel y canela. sólo alcanzando el radio urbano de cada cuidad.
2)	grupo socioeconómico: se reconoce una diferencia en la disposición a pagar por este tipo de productos y servicios (instalación de productos), desde un grupo socioeconómico a otro. el mercado potencial lo comprenden los grupos socioeconómicos clasificados como abc1 y c2. la empresa considera que una disposición a pagar por un proyecto sobre $400.000 pesos generan márgenes atractivos para la empresa, por lo cual, son estos tipos de proyectos a los cuales la empresa desea llegar. del resultado de la encuesta se puede observar que las personas que viven en las comunas asociadas históricamente a la clasificación socioeconómica abc1 y c2 en sus hogares muestran promedios de disposición a pagar superiores a los $400.000 pesos.
3)	gusto por la diferenciación en el vestir: esta variable de segmentación dice relación con la visión que las personas tienen de los productos que la empresa comercializa. debido a que el negocio está orientado a asesorar al cliente, con respecto a las posibilidades de productos, telas y texturas para cada ambiente, es importante que éste valore el servicio, tanto de asesoría como de instalación de los productos.
los costos mensuales se verán reflejados en contar con un administrador de nuestra plataforma web, vendedores en terreno, que serán nuestros principales embajadores de nuestra empresa, siendo los nexos con nuestros clientes, ademas de contar con un encargado de postular a las licitaciones gubernamentales, son los principales costos, que irán reflejados en un porcentajes de las ventas conseguidas con estos nuevos segmentos de mercados que no teníamos cubierto, buscamos transformarnos en una empresa líder a nivel regional de nuestro sector, ademas de ser una empresa que genere nuevos empleos, con seguridad para cada trabajador contratado por nuestra empresa, generando una política de costo beneficio rentable para nuestra empresa.
",3.0
15055560.0,18.0,1518814.0,"la relación que esperamos tener con nuestros clientes es de manera directa además de ofrecer descuentos según la cantidad de trabajos solicitados. 
enviar catalogo de productos cada vez que tengamos nuevas creaciones. esto será vía whatsapp, y solo se enviará a los clientes que den su consentimiento, ya que no queremos aburrir con publicidad.
la relación con nuestro cliente empresa será mas directa y presencial dentro lo que permitan las exigencias sanitarias,  evaluaremos los trabajos en terrenos para entregar precios justos y dar seguridad a nuestros clientes.",5.0
5175000.0,18.0,1790421.0,"la pagina y sistema que se adquiere sera para mantener y obtener una mayor cercania y fidelizacion con el cliente, pudiendo estar en contacto permanente mediante correos y avisos en las distintas plataformas los servicio y ofertas promocionadas en cada mes.",3.0
13143600.0,18.0,1489213.0,"- emprendedores entre los 20 y 60 años, la relación que esperamos tener es un contacto directo, personalizado y a la vez incorporarlos a una base de dato para llevar estadísticas de compras, cotizaciones , celebraciones y festejos. también para realizar encuestas para mejoramiento de la calidad de los productos y servicios , así brindar una mejor atención a sus necesidades.

- servicio:  ofrecer un buen sistema de marketing y publicidad para ganarnos la confianza de nuestros clientes. ",7.0
14862410.0,18.0,1317656.0,"la relacion que esperamos tener con nuestros clientes por segmento:
a) personas naturales: muy cercana, cariñosa y afectuosa. con comunicacion personalizada  y tambien via telefonica, redes sociales y whatsapp.  agendaremos de acuerdo a los horarios que requieren ser atendidos en un espacio intimo y con mucha confianza, donde requieren hacerse un cariño y sentirse queridos que les permita potenciar su autoestima.
b) empresas ; una relacion formal, a traves de contrato. brindaremos nuestros servicios a los colaboradores  tanto en la planta o en nuestro local.  generaremos informes de atencion y facturaremos  cada fin de mes. las empresas podran hacer descuentos por planilla o bien cancelarlos ellas  como parte del beneficio hacia sus trabajadores. la comunicacion con las empresas es via mail y telefonica, y en algunos casos whatsapp bussines.
c) instituciones publicas. sera una relacion formal generada desde mercadopublico.cl  mediante licitaciones y programas, generando informes mensuales sobre las intervenciones principalmente en barrios  hacia donde se  dirigen estas iniciativas. la comunicacion será formal  via mail con la finalidad de generar respaldos en el proceso de gestion.",7.0
4311890.0,18.0,1381987.0,"las relaciones que esperamos tener con nuestros clientes será la siguiente:
1)se generarán constantes visitas presenciales para detectar oportunidades de mejora y tendencia de consumo,  con el objetivo de captar información importante de nuevas necesidades en tiempo real. 2) enviaremos mensajes personalizados a nuestros clientes a través de correo electrónico y redes sociales, presentando promociones y noticias. esto permitirá al cliente acceder a información las 24 horas del día. 3) se contará con un call center de consultas de nuestros clientes en jornadas de 9:00 a 18:00 horas
",3.0
12266790.0,18.0,361595.0,"al inicio y al final de cada proyecto, se requieren reuniones, para transmitir los objetivos y resultados. durante los procesos, a través de correo electrónico",3.0
11933110.0,18.0,402719.0,"- la forma de relacionarme con el segmento de clientes de 18 a 39 años será cercana y cordial la cual, se transmitirá entregando una rápida respuesta a sus preguntas y dudas, despachando el producto dentro del plazo establecido y con un delicado packaging.

otro medio de comunicación a utilizar será el  newsletter, en el cual se inscribe y podrá recibir información de los nuevos productos, saludos de cumpleaños y un cupón de descuento en su primera compra.
también definiremos un descuento en fechas importantes como por ej. el día de la madre, black monday, entre otros.

los costos de aplicar un descuento y de packaging serán considerados al definir el precio final del producto.

- con respecto al segmento de las tiendas a concesión, la relación será igualmente cercana y cordial, y además será constante, agendando reuniones periódicas para tratar temas relacionados a la entrega y reposición de stock, descuentos especiales como tienda, entre otros.

el costo de relacionarme con éste segmento es mayor comparándolo con la opción de venta online ya que, debo pagar un arriendo por estar en la tienda y comisión por venta, sin embargo, me entrega otros beneficios que son importantes a considerar como la publicidad, llegar a clientes que no utilizan internet o redes sociales y me genera nuevos contactos.",7.0
12303450.0,18.0,577289.0,"nuestra empresa de acuerdo al producto que ofrece considera la relación directa
con los clientes ya que para esta idea de negocio es primordial el trato personalizado con el cliente, a la vez permite que ante cualquier disconformidad en el producto seamos alertados en tiempo inmediato y dar solución a la brevedad.

también es importante interactuar con el cliente ya que nos puede dar nuevas ideas y sugerencias que sean aplicables a nuestro producto.

",3.0
14898730.0,18.0,1511247.0,"-personas particulares: la relación es directa y con atención personalizada, a través de llamadas telefónicas, por mensajes directos en redes sociales (whatsapp, instagram y facebook) y presencialmente, mediante los cuales se les explica al cliente los servicios con los que se cuenta para que ellos puedan escoger el que desean, además de poder saber si van a requerir que se retire su vehículo en el domicilio o lugar de trabajo, o en el caso de que el vaya a dejar el vehículo, indicar la dirección comercial, también indicar la disponibilidad con la que se cuenta ya que la modalidad de trabajo es a través de una agenda de trabajo.
-empresas publicas y privadas: la relación es directa y con atención personalizada, ya que dependiendo de las características de los espacios físicos, la concurrencia de publico, la frecuencia del uso de los espacios comunes de trabajo entre otras cosas.",7.0
9940370.0,18.0,1460256.0,"la relación que buscamos formar es cercana puesto que al visitar periódicamente los negocios se crea un vinculo de familiaridad y fidelización del cliente( en este caso el dueño del negocio) quien después prefiere el producto y lo recomienda a sus clientes.
el costo sería en transporte por cada visita realizada, el tiempo que se emplea en cada una de las visitas con el cual se busca lograr establecer una relación con el cliente y como fin ultimo conseguir fidelizarlo. y los costos administrativos propios del negoció.
",3
6724840.0,18.0,1773953.0,"la importancia de fidelizar a cada uno de nuestros clientes es fundamental ya que a través de la postventa podremos detectar en que área nos debemos fortalecer y así tener una relación cercana y empática con cada segmento ya mencionado, pues nuestro objetivo principal es entregar un servicio integral para cada uno de ellos. trabajaremos en saludos personalizados vía mail anunciando nuestras promociones e invitando a cada cliente a visitarnos en nuestra plataforma online. los costos para comenzar, estarán a la vanguardia del mercado para entrar a competir con grandes marcas debemos potenciar nuestros productos.",3.0
16457710.0,18.0,2514709.0,"la relación con los clientes se generan principalmente a través de redes de contacto, boca a boca y cartera de clientes  ya existente, el paso siguiente es realiza. además, se hará seguimiento de las ventas, acompañamiento mientras gestionan todo el papeleo necesario y finalmente se hará mejoras en el servicio en base a sus experiencias. ",3.0
8808950.0,18.0,1782785.0,"relacion virtual y personal, mejorando nuestra relacion con promociones, descuentos,  gracias las redes sociales podemos materializar la comunicacion de manera online, el costos mas alto sera el trato personal",3.0
12229640.0,18.0,1625741.0,"nuestra empresa tiene una atención personalizada con cada uno de nuestros clientes ya que cada uno de ellos tiene un requerimiento diferente, dada las condiciones mecánicas/eléctricas de cada vehículo. siempre una atención individual teniendo un costo solo en tiempo ya que cada uno de ellos necesita una respuesta.
",5
10504530.0,18.0,1388887.0,personal,1.0
6593920.0,18.0,1571001.0,a través de redes sociales publicando ofertas,3.0
6734390.0,18.0,281509.0,"la relación que esperamos fortalecer es de tipo cercana, donde la compra puede realizarse de manera online, pero entregada de manera presencial en caso que sea al interior de la comuna. esto permite acercar el producto y su historia al cliente. ademas como ya lo mencionamos, mantener una apertura permanente a las opiniones, sugerencias y criticas de los clientes, con el propósito de mejorar continuamente la calidad de los productos. 
el costo de esta relación cercana, es por parte de la empresa, mantener la disposición de responder a las necesidades del cliente de manera oportuna y pertinente para lograr así su fidelización. 
lo anterior apunta tanto al cliente final como los intermediarios (restoranes, bares, etc)",3.0
15365910.0,18.0,1557937.0,una relación directa .... tenemos clientes que nos compran directamente o personalmente.... la otra forma es a través de la promoción en locales y restaurantes.,3.0
12169640.0,18.0,1497562.0,"segmento 1: se espera tener una relación cercana con el cliente a través de la web y apps, comunicando constantemente acerca de promociones y ofertas. además se planea hacer planes de fidelización y sustentabilidad utilizando el modelo de reciclaje, es decir que el cliente que nos traiga la botellas vacías que ya utilizo se le hará un descuento en su nueva compra. el costo de aplicar esta clase de comunicación en una primera fase es reducido ya que lo haremos nosotros mismos en un comienzo, posteriormente el costo aumentara al tener que contratar un media manager para la administración de las redes sociales.  
tanto al 2º como 3º segmento de clientes se mantendrá una relación presencial y más cercana debido a la distribución del mismo producto. esta clase de relación implica un costo asumido debido a que se integra con el costo de repartir, a este segmento solo se le realizaran promociones para mantener fidelización en caso de mayor número de ventas.  ",7.0
10876070.0,18.0,273781.0,"se espera tener una relación personalizada con cada cliente, esto quiere decir que exista una comunicación activa con el cliente por medio de lo siguiente:

canal digital: por medio de chat activo poder dar soluciones en tiempo real a las consultas y cotizaciones
retroalimentacion: se pretende tener protocolos de retroalimentacion  contantes para mejoras a nuestros servicio y para  confirmar siempre la calidad de nuestros productos

dentro de estos canales de comunicación la cordialidad y la experiencia del cliente es clave, es por esto que los tiempos de respuesta tienen que ser los que el cliente espera

el costo para relacionarse con cada segmento dependera de los costos de uso de la plataformas de redes digitales y del costo de capital humano para la retroalimentacion activa",3.0
6765360.0,18.0,364493.0,"para mis dos segmentos de clientes las familias y adultos jóvenes. la relación con ellos sera de forma directa y personal, la idea del negocio mas allá de brindar un servicio, es brindar una experiencia y para lograr esto debe ser de tu a tu, atentos a las necesidades especificas de cada cliente. al momento del contacto con el interesado se le realizara un set de preguntas con el fin de cubrir sus necesidades especificas, lo que busca este proyecto es que las personas realmente sientan la idea de refugio, de sentirse protegidos, atendidos e integrados en la experiencia.
el costo de los canales a utilizar en el caso de la pagina web, considera el desarrollo, confección, uso y mantenimiento, al inicio considera un costo mas alto debido al diseño y confección y luego solo considera un costo fijo mensual por el mantenimiento de esta. en el caso de las redes sociales, si bien son plataformas gratis, se puede invertir en ellas un pequeño monto de dinero que permita posicionar el negocio en listas de búsquedas, que envíe sugerencias a personas que sigan paginas de la misma linea, a personas que estén en el rango etario que nos enfocaremos, etc. esto es un poco mas dinámico ya que según el movimiento que vayan teniendo las cuentas, es el tipo de acción que hay que ir tomando, considerando el alcance que pueda tener (generalmente la red social a utilizar lo indica).",7.0
14901170.0,18.0,1386909.0,"1. cerveceros, hombres y mujeres amantes de la cerveza artesanal: son nuestros usuarios finales de nuestros productos, por lo tanto, la relación que mantenemos es cercana y semiformal, ya que el marketing de recomendación a través del boca a boca es primordial para nuestro producto.

2. empresas: aquí, buscamos siempre mantener una relación personalizada, cercana y cordial. esto porque, más que un cliente, buscamos mantener una alianza de cooperación mutua. 
",7.0
