postulante_id,pregunta_id,respuesta_id,texto.respuesta,nota
1417280.0,18.0,1472193.0,"con respecto a la relación que se espera tener con nuestros segmentos, podemos decir que:
-  la relación con el segmento de comida rápida, en la etapa de desarrollo se busca sea personalizada y luego en la etapa de implementación del sistema lograr la automatización de sus servicios, ya que por lo general, este segmento necesita de respuestas rápidas y estándar para continuar con su proceso de producción.  con respecto a  esto se asocia el uso de horas hombres para la atención personalizada.
- el comercio general  se  tendrá una relación mas cercana y personalizada,  ya que por lo general el cliente suele tener dudas y requerimientos adicionales a los pactados inicialmente.    igualmente, se busca presentar en algunas etapas el avance a nuestros clientes, para su tranquilidad y pueda ver como se esta dando solución a sus requerimientos.
- persona natural:   se espera tener una relación relajada y personal, teniendo en mente que por lo general, las necesidades de las personas naturales son menos estándar que las requeridas por una empresa, por ende requiere tomarse mas tiempo a veces para captar lo que el cliente quiere plasmar, desde su punto personal en el software a crear.",5.0
12261100.0,18.0,618919.0,"con el primer segmento del rubro de la construcción se buscaría mantener una relación estable ya que constantemente requerirían de nuestros servicios, con el segundo segmento de clientes referente a medianas empresas la relación debería ser esporádica y posiblemente única con cada cliente. por esto con el primer segmento para mantener la fidelidad del cliente durante la captación o primer proyecto se evaluaría el hacer descuentos considerables y mantener un foco en la calidad y estabilidad de los trabajos. con el segundo segmento de clientes se mantendrá el foco en la calidad y estabilidad de los trabajos y se actualizara periódicamente la pagina web y redes sociales con fotos y vídeos de los trabajos realizados para captar mayor y mejor clientela, y que estos mismos recomienden nuestro trabajo.",7.0
8039830.0,18.0,1367911.0,"cliente empresa:
 nuestras alianzas estratégicas generadas tendrán un descuento significativo a la hora de necesitar nuestros servicios, tendrán una prioridad de acuerdo a la urgencia y carga de trabajo a realizar , acudiendo a sus dependencias para el retiro de vehículos si lo requiere , se generaran reuniones, folletos, cartas de presentaciones, y publicidad  de información necesaria y clara  para fortalecer las alianzas ,tendremos una comunicación efectiva y clara relacionándonos de la mejor manera posible brindándoles un fuerte apoyo en sus requerimientos.

cliente natural: 
una de nuestras mayores fortalezas en fidelización es que nuestros clientes particulares estarán más activos mediante canales digitales y recibirán información y consejos sobre el mejor cuidado estético automotriz. a la vez podrán ir viendo los trabajos realizados eh interactuar y preguntar sobre los diferentes servicios. constaran de un lavado básico gratis después de 1 mes aplicado nuestro gran producto sellador cerámico, nuestra relación será tanto personal como por redes sociales y/o digitales .",7.0
4305940.0,18.0,255358.0,"la relación  es de forma directa.
el costo es relativamente  bajo ya que es a través de redes sociales ",1.0
931950.0,18.0,1645429.0," para endemiqa! macetas, la relación con los clientes representa un aspecto primordial, y en cual prestamos especial detalle. acompañamos todo el proceso desde inicio y  hasta  que se concrete la compra. los canales de distribución y atención son de manera directa, por esto para relacionarnos a través de los medios digitales, redes sociales que nos permitan desde el acompañamiento desde la publicidad y difusión, después canales de gestión de compras y posteriormente tener un feedback y conocer percepción de satisfacción de nuestro acompañamiento 
(1) proceso de gestión y relación de clientes (publicidad y posicionamiento en segmentos clientes) implementar un sistema y publicidad en instagram, facebook, desarrollando una estrategia de publicidad, estrategia de adchoices, contratando servicio según la segmentación que nos sea útil de acuerdo a nuestras segmentación de clientes segmentación, que considera endemiqa! macetas de acuerdo a la segmentación de clientes objetivos según lo siguiente: ubicación, datos demográficos, intereses, segmentación, comportamientos, priorización de segmento especifica automática. esto debemos tener en cuenta que podemos segmentar para focalizar, así tenemos claro donde esta y que hace, que desea y cuando nuestro cliente. es en esta fase donde implementamos actividades de publicidad para cada segmento, es importantísimo para nuestro negocio. 
(2) el proceso durante la venta debe ser perfecto, en donde el cliente tiene que sentir que posee todas las facilidades del mundo para adquirir tus productos. entendiendo que hay distintos tipos de clientes, tienes que tratar de conseguir que la venta se realice de forma adecuada y cómoda para la mayoría de ellos. contratar sistema de gestión de ventas, que nos permita llevar todo el proceso, monitorear y resolver cualquier problema. 
(3) después de la compra, acompañamos a nuestro cliente con un servicio calidad que ayude en caso de problemas o no satisfacción, entregando servicios de postventa de excelencia. estos feedback nos permiten y nos sirven considerablemente para mejorar el proceso de compra. para una mejor experiencia con el cliente, una herramienta que entrega mucho valor agregado en las fases de gestión del cliente es un crm (customer relationship management). costos de acciones en relación con clientes: - configura tu tienda y contratación de servicio de tienda online con servicios complementarios ( plan basic shopify, todo lo básico para comenzar a vender por internet) cuota mensual usd29 $mensual/mes - sales manager crm enfocado en pymes ( plan crece $11.900 + iva /mes precio por usuario 4 gb de almacenamiento) servicio contratado en entel empresas - plan de internet y telefonía ilimitada ( $ 26.990 plan mensual, con minutos libres ) - plan campaña publicidad basica en facebook , (desde 3000 pesos)
",3.0
6780860.0,18.0,1637885.0,"en casa de mascotas todos nuestros clientes son importantes, por lo tanto, nuestro servicio estará orientado en instaurar una relación de constante fidelización, para esto siempre abra en nuestro local presencial, y de forma online, un profesional en la atención, el cual podrá escuchar, comprender y guiar de forma personal en las necesidades del cliente. 
todo el local estará diseñado con colores especiales relacionados con mascotas, limpieza y orden, lo cual entregará al cliente seguridad y una sensación de bienestar al realizar su compra. 
el servicio de peluquería estará avalado por las capacitaciones que el personal realizara constantemente, enseñándole a los clientes las técnicas y los utensilios que se utilizaran en la actividad, esto instaurara en el cliente confianza y seguridad. mediante llamado telefónico se coordinarán las acciones de entrega de productos solicitados mediante llamado telefónico y redes sociales, lo cual ayudará al cliente a optimizar sus tiempos, ya que no tendrá que asistir a realizar su compra directamente en el local y tampoco tendrá que gastar energías en el transporte del producto seleccionado. 
según segmentos:
los costos de relacionarse con cada segmento serán mínimos
niños: estos estarán felices de asistir a comprar a nuestro local ya que los colores, aromas y distribución de productos estarán pensados para una compra ágil, informativa, divertida y segura. sin costo asociado.
jóvenes: casa de mascota tendrá una relación muy amigable con este segmento, entregando ofertas especiales y nuevos productos a través de las redes sociales, plataforma muy visitada por este segmento. lo cual no tiene costo agregado ya que facebook, instagram, pinterest tiene opciones de no pago.
adultos profesionales: dado el poco tiempo que estos usuarios tiene debido a sus ajetreadas vidas, casa de mascotas enviara mediante correo electrónico y mensajería instantánea información relevante sobre productos relacionados con la mascota que este posea, precios y ofertas. no hay costo adicional por envios de e-mail y whatsapp. adicional a esto el usuario podrá cancelar mediante plataformas digitales y retirar en tienda, lo cual facilitara la vida del cliente. esto tiene un costo al usar la plataforma de transbank lo cual incurre en un 1,19% aproximadamente por transacciones realizadas con debido y un 2,2% aproximadamente en compras realizadas 
adultos y adultos mayores: la comunicación con estos usuarios será en su mayoría a través de anuncios radiales los cuales tienen un valos mensual de 30.000 pesos aproximadamente en radios comunitaria, avisos que llegan a una cantidad de miles de posibles clientes en cuestión de minutos.
municipalidades e instituciones con y sin fines de lucro: mediante la visita a los actores correspondientes se informara la venta al por mayor y los servicios de peluquería canina, los cuales se podrán adquirir mediante lisitacion en el mercado publico, transformando la comunicación por via email.
",7.0
5006800.0,18.0,1462487.0,"1° segmento \hombres y mujeres de alto poder adquisitivo\"" (segmento principal, target): con este segmento de mercado esperamos tener una relación de tipo mixta (personalizada y automatizada), a través de los siguientes canales de comunicación:", 
14107580.0,18.0,2515123.0,"con cada segmento espero tener una relacion de fidelización tomando en cuenta el servicio personal y la postventa realizada, actualmente mantengo online una pagina en redes sociales, específicamente la mas utilizada es instagram, la cual me permite realizar el servicio post venta, en el cual se incluyen los trabajos realizados los cuales pueden ser, compartidos por las mismas clientas a las cuales les realice, y comentados por otras, también existe la posibilidad de crear juegos de selección que hacen que exista una mayor interacción, mantenerse constantemente con actividades en redes, ",5.0
12270190.0,18.0,378592.0,"la relación con los clientes estará enfocada principalmente a la asistencia personal donde las actividades serán entregadas a los clientes de acuerdo a sus requerimientos. sin embargo de forma complementaria se desarrolla gestión a traves de medios digitales como pagina web, correo, telefono y redes sociales, donde los clientes puedan compartir sus experiencias, programar visitas y contratar servicios, los mismo para el caso de los estudiantes donde podremos realizar convenios con universidades, y para el caso de los operadores tendremos contratos de trabajo con servicios especializados acorde a los grupos que administren.",7.0
4198670.0,18.0,1254291.0,"la relación con el cliente será  de acuerdo al canal de distribución por el cual se contacte:

- plataforma web; cuando el cliente llegue a la plataforma, se le abrirá un mensaje
preguntando si se puede hacer algo por el, además podrá abrir directamente un mensaje
por whatsapp, es decir el contacto será inmediato.

- redes sociales; cada vez que el cliente se contacte por redes sociales, se le responderá lo
antes posible, a través, de un mensaje directo o por una promoción donde el cliente al dar click se le enviara automáticamente un mensaje al whatsapp. se tendrá un número de celular, el cual estará siempre estará encendido y tendrá un administrador que lo conteste y de pronta respuesta.

- kiosco; la relación será directa resolviendo sus dudas y generando la venta directa de
servicios.",3.0
10739890.0,18.0,1489742.0,"como apicola herrera es fundamental que la relación de cercanía con nuestros clientes sea prioridad, es por esto que los hemos dividido en dos segmentos que tienen la misma importancia desde nuestra empresa, así llegamos a ellos de la mejor manera, cubriendo sus necesidades, con una relación directa con cada uno de ellos, conociendo su entorno, como se desenvuelven socialmente, lo que quieren lograr a corto y largo plazo, así los fidelizamos mediante su satisfacción al adquirir nuestros productos o servicios.

también utilizaremos nuestras redes sociales, pagina web para mantener un contacto permanente con nuestros clientes, entregando informaciones, tips sobre el rubro, estadísticas, enseñando técnicas de buenas practicas apicolas, entre otros, para que sienta seguridad y lo mas importante que podamos contribuir con su emprendimiento o empresa. de nuestra parte también se desarrollaran estrategias para que el cliente se sienta respaldado y acogido en todos los ámbitos elaborando saludos en fechas importantes, recordando los tramites que deben realizar en otras áreas relacionadas a la empresa. 

por último debido a la contingencia se elaboran reuniones personalizadas con los clientes de manera online, para poder tomar sus necesidades y cumplir las metas dispuestas a corto y largo plazo.",3.0
14172810.0,18.0,1470261.0,de preferencia será de forma presencial mediante atención directa con el cliente se pretende incorporal las vía virtual ya que la tecnología ha ido avanzando en un futuro espero hacer envíos según lo soliciten los clientes.,3.0
15237510.0,18.0,2512570.0,"la relacion que se espera tener con los clientes es una relacion personalizada, de cercanía con el cliente, ya que la idea es esta preocupados de sus necesidades, de los gustos y preferencias de los clientes para saber si el producto es de su agrado o también para ver el quiebre de stock y poder abastecernos de los productos que son mas demandados que otros. el costo asociado a la implementacion es solo el pago de plan de telefonía móvil para poder tener whatsapp",3.0
15042440.0,18.0,1316023.0,tendré relación directa y los costos son bajos ya que la mayoría de los medios de comunicación de los cuales haremos uso no tienen mayores gastos a excepción de la publicidad que se le incorporara al furgón que esa tiene cierto costo. pero en general son bajos y tendremos relación directa con toda nuestra clientela así poder fidelizarlas que es la idea primordial tener clientes fieles y nos compren solo a nosotros.,5.0
2961740.0,18.0,1566884.0,"como se ha descrito en el programa, buscamos una personalización con cada cliente, para poder llegar a los objetivos que ellos necesitan. en primera instancia les daremos una conversación telefónica con cada una de las parte involucradas, la nutrición, el entrenamiento y la motivación. también las sesiones de motivación son en vivo. ",3.0
1865810.0,18.0,1175746.0,"el tipo de relación que se tiene con los usuarios y clientes es personalizado, flexible y directo, debido a se quiere además entregar un valor agregado en base a recomendaciones considerando experiencia en servicios médicos.   la atención es diaria de lunes a domingo por lo que hace la relación más flexible que en otras empresas o organizaciones que mantienen un horario restringido, esto permite que el contacto sea con disponibilidad completa.

la relación con clientes de 3era edad contiene parámetros formales y personalizados, considerando las diferentes necesidades y exigencias, tanto en el diseño de los productos, su cantidad y la entrega.   los canales son flexibles, como también su modo de pago.

la relación con los clientes con molestias musculares y óseas crónicas y personas con lesiones contiene parámetros técnicos que en conjunto con apoyo con kinesiólogos o médicos relacionados a la patología en particular, puedan entregar recomendaciones de los productos. 

la relación con los clientes deportistas es flexible y abierta en todo tipo de comentarios que ayuden a mejorar los diseños de los productos.   la relación con este segmento de cliente además permite opiniones, comentarios, reseñas que ayuden a promocionar los productos.  es vital mantener un nexo permanente debido a que los círculos de deportistas pueden viralizar los productos a ofrecer entre ellos y por tanto obtener mayor venta. 

la relación con clientes madres y embarazadas es totalmente personalizada, flexible y abierta considerando las diferentes etapas en que se encuentran.  la relación es bastante profesional considerando que nuestro equipo tienen como profesión la maternidad (matronas) por tanto las necesidades de los productos, entrega, maneras de pago se realizaran en coordinación, como también observaciones, comentarios y recomendaciones de uso.

la relación con clientes con estrés tiene un poco más de cuidado en el lenguaje, debido a la situación en que los clientes se encuentran y por tanto la relación tiende a ser formal y respetando diferentes acuerdos entre ambas partes, como es las necesidades y cantidades de los productos, fecha y hora de entrega como también el modo de pago.  se espera que los productos ayuden tanto física como mentalmente en la recuperación de sus molestias.
",7.0
13849020.0,18.0,1217330.0,"la cercanía con los clientes es primordial, con más información de ellos, más amigable será el servicio, el enfoque es de economía circular y apoyo al medio ambiente, el cual permitirá estar en constantes comunicaciones con ellos, también interactuando a través de las redes sociales para que manden ideas de cómo mejorar procesos o reciclar nuestros envases y las ideas más innovadoras tendrán descuentos y serán publicadas en páginas oficiales...",5.0
4860730.0,18.0,1527071.0,"nuestro taller esta interesado en crear relaciones a largo plazo con todos los tipos de segmentos de clientes descritos, para mejorar la realización del servicio  y estar atentos a las nuevas necesidades del cliente.

la relación con el segmento de clientes particulares es de forma personalizada,
manteniendo constantemente información de los servicios por ofrecer, precios y promociones; ofrecer a este cliente la posibilidad de comprarle los repuestos que necesite o asesoramiento durante la compra; se aplican encuestas de satisfacción, consulta de preferencias y mejoras en la atención o la incorporación de nuevos servicios.

con respecto al segmento de clientes de empresa la relacion es es directa en el taller , la cual momentos antes pudo a ver sido via telefonico o whatsaap, teniendo en cuenta a la hora de llegada todo lo necesario para que la realizacion del servicio sea eficiente y rapida, se aplicaran encuesta de satisfaccion y se guardara el contacto del cliente para su proxima atencion, entrega de informacion de  productos y servicios,",7.0
12273460.0,18.0,308258.0,"con el segmento de bares, pubs, restaurantes, etc. tendremos una relación presencial principalmente, en que nos acercaremos a conocer cómo ha sido la venta de cervezas, si han tenido problemas con el producto, educar a su personal en el servicio y descripción de las cervezas, entre otros. además, con este mismo segmento de clientes se realizará una comunicación virtual, ya sea por teléfono o mensajes preguntando el nivel de stock, nuevas cervezas que van saliendo o si les podemos ayudar en algo durante la semana.
con el segundo segmento de clientes se tendrá una relación virtual en lo que respecta a las redes sociales y también presencial cuando se traten de eventos como ferias de las cervezas o abramos la planta de producción al público. ",7.0
12265990.0,18.0,362101.0,espero y deseo tener una relación comercial satisfactoria como la que ya estamos teniendo en los primeros bares a los cuales les vendemos hoy. estar atentos a sus solicitudes de acuerdo a lo que observan de la devolución que le entregan sus propios clientes poniendo énfasis en la flexibilidad que nos da el ser una pequeña empresa de comida casera que puede adecuar sus procesos de acuerdo a solicitudes u observaciones que nos hagan quienes prueban nuestra comida.,5.0
12267390.0,18.0,363113.0,"para mantener la relación con cada uno de los grupos segmentados, generaremos campañas segmentadas en facebook, instagram de recordación en fechas claves (día mundial de los animales, fecha en la que se promulgo la ley cholito), y con autorización del cliente para poder publicar de manera respetuosa la despedida de su mascota en forma de homenaje.
de igual manera con las clínicas veterinarias emblemáticas, realizaremos merchandising cruzado con el nombre de la clínica y de nuestra empresa, lo que nos permitirá captar nuevos clientes.",7.0
15123440.0,18.0,1374167.0,"la idea es ser muy cercana con el cliente, tratando de conocer sus gustos y entregar un servicio personalizado para cada cliente.
un cliente conforme y feliz siempre llegará con nuevos clientes.",3.0
11880640.0,18.0,328590.0,"en función de los dos segmentos definidos la estrategia de relación con los clientes también será dual. 

para nuestro primer segmento, a saber, jóvenes profesionales entre 25 y 35 años de ingresos medios altos, apuntaremos a la captación de clientes. este segmento lo caracterizamos como turistas que visitan la comuna de monte patria y residentes de las provincias de la región de coquimbo. la relación con el cliente será personalizada, es decir, tendremos contacto directo a través de las redes sociales donde detallaremos las distintas actividades a realizar y cuál de ellas se ajusta a sus intereses y capacidad de pago.

para el segundo segmento, a saber, empresas e instituciones públicas, apuntamos directamente a la fidelización de los clientes logrando realizar varias actividades con un cliente. en este sentido generamos una relación de asistencia personal exclusiva con nuestro cliente haciéndola más íntima y totalmente personalizada en función de lo que quiera y las características de sus colaboradores apuntando a la fidelización del cliente.

el costo para ambas segmentos es diferente. el costo de transacción para el primero es menor que el segundo ya que en el último se hace necesario mayor inversión en términos de tiempo ya sea en traslados, reuniones, creación de presentaciones entre otras que no están presentes en el primer segmento ya que el canal de contacto es netamente virtual reduciendo los costos antes mencionados.
",7.0
12465330.0,18.0,676649.0,"relación directa con mis clientes de forma presencial en el local de forma online por redes sociales, atendiendo consulta que puedan surgir a los futuros clientes, dando información también de los atractivos cercanos, y que son los que atraen el flujo de turistas.",3.0
1830060.0,18.0,693761.0,"la relación con los clientes es directa y el costo es relativamente bajo ya que mayormente se utiliza el  transfer de la zona y también de redes sociales y vehículos particular
esto quiere decir que con mis clientes diarimente mantendre una relacion cercana y cordial para hacerles sentir comodos y a gusto con la atencion y el producto recibido, mientras que para los eventos masivos o con gran convocatoria de gente sera necesario poder mantener una relacion mas formal para lograr acuerdos y cerrar contratos.      ",3.0
14319240.0,18.0,1602143.0,"la relación que tenemos que tener con nuestros clientes es personal, debemos saber muy bien qué es lo que están haciendo nuestros clientes y hacía donde quieren ir para apoyarlos con pólizas a la medida de los riesgos expuestos. esto acompañado de canales virtuales para acelerar aquellos procesos no críticos en nuestro modelo de negocio y que nos ayuden a entregar un servicio al cliente 24/7.

el costo de la personalización es principalmente tiempo junto con inversión en desarrollos tecnológicos que hoy día están al alcance de todos como por ejemplo boot de whatsapp, crm entre otros.
",3.0
8406970.0,18.0,395704.0,"pretendemos que la relación sea directa, en lo posible funcionar como amigos o partner de nuestros clientes, trabajar en conjunto con feedback permanentes de ambas partes, ya que siempre se puede ir mejorando, tanto los clientes como nosotros. por lo mismo a través de nuestras redes sociales y/o web saludaremos a nuestros clientes para aniversarios o fechas especiales, lo que además les generará recordación de marca por medios externos a los suyos.",5.0
1283830.0,18.0,377833.0,"como se ha planteado los canales de comunicacio´n son indirectos o virtuales con los segmentos de clientes, dado que opera intermediado por otros agentes tanto en la difusio´n como en la comercializacio´n del productoahora bien, la capacidad de e´xito del lodge nativa depende de la capacidad de cercani´a y confianza que genera la experiencia, esto es clave para el propio visitante sino para la socializacio´n de la oferta de ellos de sus redes familiares, sociales y profesionales. para esto es clave contar  con  una recepción de primer  nivel que genere un clima de conocimiento, apertura y disfrute que transforme la experiencia en un momento inolvidable y lleno de informacio´n u´til para su masificacio´n. el costo para relacionarse con cada segmento va asociado a la cantidad de personas que conformen los grupos de visitantes y el pai´s de origen puesto que requerimientos de apoyo idioma´tico para facilitar la experiencia. ",3.0
14957150.0,18.0,1241848.0,"buena , el costo seria bajo.",1
7854370.0,18.0,1319450.0,"para  la creación de los jardines en miniatura personalizados , se debe interactuar con el cliente de forma activa,  principalmente mediante redes sociales,  consultando su idea de diseño y preferencias,  logrando así una relación cercana y personalizada.
una de nuestras fortalezas de fidelizacion, es que nuestros clientes reciben información y consejos prácticos sobre el cuidado de las  plantas en general y sus beneficio y tienen  un obsequio especial  al comprar mas de uno de nuestros jardines.
",3.0
