postulante_id,pregunta_id,respuesta_id,texto.respuesta,nota
11910220.0,18.0,691070.0,"se espera tener una relación, estable y duradera en el tiempo, con los diversos clientes, que satisfacere.
en muchos casos la idea es relacionarse por redes sociales o medios electrónicos, ya que de esta manera lograremos contar con una forma en la cual sea un contacto directo y constante.",3.0
12507140.0,18.0,676833.0,"- se espera tener relación directa y personalizada con todos los segmentos de clientes.
- también se tendrá relación de comunicación por teléfono.
- con los clientes frecuentes, se tendrá ofertas de precios.
- por la cantidad de productos solicitados se hará un precio al por mayor.
- habrá despacho a domicilio.",7.0
259200.0,18.0,1226461.0,el cliente puede ver lo novedoso y belleza de los artículos fabricados.  desconozco los valores de la difusión gráfica ,1.0
12791000.0,18.0,1470031.0,"la relación que esperamos es personal al igual que el impersonal, a través de las redes sociales, puesto que casi todo el mundo maneja esta plataforma siendo mas económica y expedita. en el ultimo punto no habría costo monetario mas que de tiempo, en tanto la primera forma, tendría costos de transporte y tiempo para concretar una relación.",3.0
15378580.0,18.0,1783107.0,"por las redes sociales, se tendrá una relación directa y cercana con cada clientes, específicamente por mensajería interna, se contratará campañas publicitaría cuyo valor diario es aproximadamente de 1.200 por día, se considerará 30.000 al mes de costo de publicidad de redes sociales, los correos masivos tendrán un hiper vinculo hacia whatsapp, el costo de publicidad es 0 en este ítem, en los eventos masivos (considerando 4 en el año) tienen un costo del 20% de las ventas, los anuncios en las radios locales tienen una duración de una semana, cuyo valor promedio es de 90.000, se considera un anuncio por mes.",3.0
15016720.0,18.0,1370211.0,"para nuestro segmento empresa nos enfocamos en una relación de asistencia los más personalizada posible y  formal entregando  orientación  para satisfacer la necesidades requeridas en la adquisición de nuestros productos  adaptándonos a sus requerimientos en un  proceso cocreativo  haciéndolos  participe en determinados ciclos del producto de ser necesario para la búsqueda de una preferencia que lleve a un vínculo de largo plazo.                                                                       para nuestro segmento personas nos enfocamos en una atención digitalizada y amigable, con ciertos pasos automatizados para agilizar la compra, entregando de igual forma opciones de dialogo para consultas con respecto a nuestros productos, contando además con un  proceso de posventa,  potenciando el vínculo y la fidelización  con atractivos descuentos  y concursos  participativos en la búsqueda de preferir nuestros productos ",7.0
7621230.0,18.0,1731334.0,"
para cada segmento coincide propósito profundizar en las terapias como una herramienta de gestión de salud entregando calidad en el tratamiento terapéutico alternativo y tecnología en sus herramientas de gestion de salud.
el costo  en las formas de relacionarse con los segmentos es el tiempo invertido en   capacitación, crear eventos de redes que generan retroalimentación, además de sembrar ideales terapéuticos, basado en otro paradigma de la curación",5.0
10931690.0,18.0,636790.0,"lo que nosotros buscamos como negocio es tener una relación cercana con cada uno de nuestros clientes, atendiéndolos de tal forma de que seamos prioridad para ellos antes que la competencia. 
la idea de esto  es que nuestros actuales y futuros clientes se sientan cómodos al momento de adquirir alguno de nuestros productos con el fin de quedar bien catalogados como un negocio que atiende bien a sus clientes, que vende un producto de excelente calidad y así también aumentar aun más nuestro mercado e ingresos.

solo algunas de estas acciones generan costos mínimos para el negocio sin embargo en relación a los beneficios producidos se trata más de una inversión que un gasto ya que fidelizamos nuestros clientes, generamos confianza en ellos y multiplicamos nuestras utilidades en la empresa.
",5.0
11402750.0,18.0,1142820.0,"se espera tener una relación cercana y de confianza con el segmento de clientes descrito para así fidelizarlos con nuestro emprendimiento. el costo de relacionarse con los clientes será mínimo, ya que solo se ocuparán recursos para implementar folletos publicitarios en las diferentes tiendas objetivo. en el caso del merchandising, es posible ocupar mas recursos económicos, ya que esto requiere fabricar algunos artículos que promuevan la marca y lo que se requiera vender.",5.0
13481480.0,18.0,1374857.0,"•	la relación que espero tener con el segmento 1 (jóvenes y adultos que tienen mascotas), será directa y cercana, ya que cada producto es hecho personalmente y con mucho amor para cada uno de nuestros clientes peludos (mascotas). nos preocupamos de cada detalle y de solucionar cada inquietud que tengan con respecto a nuestros productos. la mayoría de nuestros clientes vuelven a buscarnos ya que somos capaces de empatizar en cualquier situación que posean. ayudamos a que puedan escoger la mejor opción para su mascota, asesoramos en cuanto a modelos y telas y a la manera en como tomar sus medidas. damos facilidades de pago, y a nuestros clientes más queridos hasta le vamos a entregar a sus casas sin costo alguno. 
se ofrecerán promociones y concursos en los cuales nuestros clientes podrán participar para ganar excelentes premios.
el costo es monetario cuando debemos gastar en bencina para el auto cuando vamos a dejar nuestros productos sin cargo adicional y costo en tiempo cuando debemos atender con mucha calma y paciencia a clientes que les cuesta un poco más entender la metodología de compra.

•	la relación que espero tener con el segmento 2 (pymes), es una relación cordial y cercana mientras el tiempo y la demanda lo permita. la comunicación siempre será directamente con nosotros ya que no poseemos una plataforma que pueda reemplazarlo. los pedidos se anotarán en una planilla y luego serán despachados y entregados cuando estén terminados.  
",7.0
15365860.0,18.0,1683080.0,"via telefonica, se pueden implementar encuestas de satisfaccion asi tambien via correo electronico, visitas presenciales para obtener de primera fuente la valoracion del servicio.
el costo de implementar la pagina web es de $500.000 y un plan telefonico $10.990.-",3.0
12003230.0,18.0,376131.0,"la relación que nuestra empresa debe tener con cada cliente que se dispone a dirigirse a un programa a realizarse programado por nuestra empresa, debe ser de total confidalidad, con motivo de poder fidelizar al cliente y que de esta forma, puedan asistir constantemente a los programas calendarizados por nuestra organización.
 ademas de demostrar que nuestros coach o staff, están al 100% conectados con la salud física y emocional de cada cliente, considerando asi, una preocupación para que las personas que acudan al recinto, puedan lograr el objetivo de obtener una vida de constante actividad física.
",3.0
15030670.0,18.0,1481554.0,"el medio virtual, a la fecha, nos permite socializar de forma cercana y amigable con nuestros posibles clientes, permitiéndonos dialogar y darles a conocer cada uno de nuestros productos a fin de que se interioricen de nuestro servicio y concretemos la venta.

nuestra manera de comunicarnos es a través de conceptos corenanos como chingu que significa amigo y siempre explicamos todo lo que lo nuestros posibles clientes quieren saber acerca de lo que vendemos, orientándolos en la preparación y forma de consumo.

es importante destacar que todas las ñam-ñam box van con un obsequio de regalo (galletas de la fortuna, chopsticks, vasos, etc.)",7.0
12177620.0,18.0,356742.0,"en un primer lugar la manera de relacionarse con el cliente que creemos que tiene un mayor potencial, es la de las redes sociales. actualmente contamos con una cuenta de instagram ( @rcpvital ) y con una cuenta de facebook, que periódicamente nos reportan clientes. nuestro proyecto es potenciar esta vía de diálogo con nuestros clientes mediante una asesoría externa y con capacitacion a nuestros empleados.
además queremos instruirnos en el uso de google ad manager para poder posicionarnos de mejor manera en el buscador mas común y que podamos ser visibles a más personas. el costo asociado a estas campañas es directamente proporcional a la magnitud de la campaña y la cantidad de gente a la que se quiera acceder. 
junto con esto continuamos con el uso de medios de comunicación mas tradicionales como el uso de llamados a oficinas y mails a conocidos, familiares y redes de contacto que hemos generado con el tiempo. este formato funciona con un grupo demográfico en general de mayor edad y que no se relacionan tanto con las redes sociales en el día a día. el costo asociado a esto es el tiempo invertido.


",3.0
14657030.0,18.0,1611642.0,"esperamos tener una delación cercana con nuestros clientes a través de diferentes medios adecuados a cada segmento. en el caso de los jóvenes y adultos jóvenes nuestra relacion se establecerá principalmente a través de redes sociales, sumando la comunicación en nuestro futuro local. en el caso de los adultos mayores o personas que no se manejan adecuadamente vía online, tendremos la comunicación telefónica y presencial en nuestro local comercial. 
el costo de la relacion cliente/empresa a traves de redes sociales y via llamado telefonico casi no presenta costo monetario, ya que contamos con un plan de celular con minutos y redes sociales de uso libre, contratado desde antes del inicio del emprendimiento. en cuanto a la relación en un local establecido, es donde se presenta un costo mayor, puesto que debemos invertir en infraestructura e implementación. la puesta en marcha del local tendría un costo de alrededor de 3-4 millones de pesos. 
",5
12364400.0,18.0,681318.0,"ser amable  y entender  al cliente de las cosas que manda a realizar y que el cliente se vaya satisfecho con el trabajo que mando a realizar. ser empática, cálida en la recepción, comunicación fluida a través del teléfono ",3.0
8193510.0,18.0,1642071.0,"es una relación indirecta debido a que se trabaja principalmente con canales digitales, sin embargo se implementaran estrategias para acercarnos más a los clientes suscritos en la plataforma, como lo son regalos o descuentos para fiestas y cumpleaños. 

los costos asociados a publicidad en redes sociales tiene un valor de 0,6 usd aproximadamente por like, por lo que se deberá tener a disposición alrededor de 270.000 para realizar la campaña inicial y alcanzar alrededor de 300 clientes. ",5.0
14916310.0,18.0,1324211.0,"los segmentos de clientes son diversos jefes de hogar o personas de distintas edades y sexo que requieren de un mueble funcional o algún elemento decorativo con maderas nativas y/o recicladas, la atención en el taller tiene el costo de oportunidad por el tiempo que se invierte en el cliente que tiene su recompensa al concretar una venta.
la relación con los clientes a través de las redes sociales es mas impersonal pero es la oportunidad de alcanzar mayor difusión, con nuestros contenidos expresamos nuestros elementos diferenciadores que dan valor a nuestra propuesta haciendo la mas personalizada sobre la necesidad de cada cliente, el costo de internet se asocia a estos contactos con los clientes y el tiempo invertido en la interacción.",5.0
7001140.0,18.0,1604673.0,"en cuanto a la relación que mantengo con mi primer segmento de clientes, esta; aunque no deja de ser profesional, es mas cercana ya que la comunicación con la persona que realiza el pedido es mas fluida al momento de pedir lo que desea, por la personalización de cada pedido se requiere hablar mas, escuchar opciones y darlas por lo tanto se brinda una comunicación amena y de confianza para que el/la cliente se sientan a gusto con su encargo. esto no tiene mayor costo que unos $30.000 mensuales entre regalías y pago de medios de comunicación personalizada. la relación que tengo con mi segundo segmento, es mas profesional-empresarial ya que son clientes desconocidos a los cuales se les debe dar una imagen de respeto y profesionalismo a modo de que puedan depositar la confianza de su encargo en mi empresa. muy pocas veces me piden menos o mas de las minutas ya pactadas, por lo que la relación es de seriedad, respeto y confianza profesional y esto hace que estén dispuestos a asumir el costo que implica esta cadena de producción y distribución. su costo (de este tipo de relación) no significa mucho y oscila entre 8000 y 10000 pesos por mes, de acuerdo a lo ya descrito anteriormente.",7.0
12216800.0,18.0,322357.0,"se crea una relación de carácter personal, con cada segmento ya que se creara un producto a medida y para esto se necesita crear un vinculo de confianza",5.0
12971570.0,18.0,1503220.0,"se espera tener una relación directa y presencial con nuestra clientela tanto con las personas
naturales entre 35 y 45 años sin discriminación de género, como también pequeñas y grandes
empresas y organismos públicos, cuando las condiciones de distancia lo permitan o cuando nuestros
clientes decidan acercarse a nuestro negocio dando la mejor atención a los requerimientos o
solicitudes, de igual manera también manteniendo una relación digital o virtual, en la cual nuestros
clientes podrán realizar sus solicitudes y pagar a través de web pay o transferencia, posterior a esto
se realiza envío del pedido o retiro de forma presencial por parte del cliente según su requerimiento.
de acuerdo a este modelo de negocio los costos asociados en la forma de relacionarse con nuestros clientes se incluyen perfectamente en el costo de nuestros productos.",5.0
14341850.0,18.0,1654882.0,"la relación con nuestros clientes principales será bastante cercana ya que los proveeremos de insumos de manera constante y de la asesoría que requieran en el momento. los métodos para lograr esto serán el contacto directo desde un local instalado además de mensajería instantánea por redes sociales.
los costos de esto último serán relativamente bajos, ya que principalmente sólo será el tiempo de atención y el costo de mantención de las plataformas digitales.",3.0
14880390.0,18.0,1713693.0,"para lograr una relación de largo con nuestros clientes nuestro servicio debe cumplir su objetivo que es el de realizar una aplicación exitosa la cual cree un verdadero impacto en su producción. con el paso del tiempo y realizando una base de datos con todas las aplicaciones realizadas podremos tener las estadísticas de cada plantación que hemos aplicado y ver cuáles son los productos más efectivos para cada plantación, ya sea para eliminar la maleza o alguna plaga. de esta forma no solo entregaremos el servicio de aplicaciones, sino que también podremos asesorar en las aplicaciones de creando una relación más cercana con nuestros clientes ya que si a ellos les va bien a nosotros también.",5.0
15083620.0,18.0,1411450.0,"las relaciones que se buscan lograr con los distintos tipos de clientes son:
•	relaciones a largo plazo, donde el servicio y la compra de productos se hagan habituales, que su preferencia se vea plasmada en las recomendaciones que ellos mismos podrán entregar a sus conocidos o amigos.
•	que sea una experiencia única para el cliente, de manera tal, proyectando una experiencia de compra superlativa y que no le den ganas de visitar otras tiendas.
•	relación con los clientes a través de nuestras redes sociales donde poder interactuar, compartir información y promociones, que puedan realizar sus pedidos y agendar retiro en la tienda o despacho hasta sus domicilios.
•	whatsapp, número único de la tienda para realizar cotizaciones y solicitudes de pedido en caso de no poder asistir físicamente como por ejemplo lo sucedido con las tiendas en tiempo de pandemia y las fases establecidas por ley donde no se puede operar y se debe mantener el confinamiento.
",3.0
12254590.0,18.0,318263.0,"nosotros contamos con una relación de tipo mixta, ya que nos relacionamos a través de redes sociales, mayoritariamente online, teniendo de todas maneras la opción mediante número de contacto telefónico y correo electrónico. sin embargo, también poseemos una relación personalizada al realizar la entrega de forma presencial y directa, recordando los nombres de nuestros clientes y formando una relación cercana. ",5.0
888360.0,18.0,1678066.0,"para el primer grupo esperamos tener una relación mas directa que virtual, debido a que esperamos ellos asistan a nuestro local comercial, lo cual bastante bueno porque a medida que los vamos conociendo vamos realizando feed back, es más tendremos siempre papeletas para que vayan marcando opciones y entregando opiniones, ya que es muy importante para poder ir mejorando y satisfaciendo a nuestros clientes, que nos vayamos retroalimentando.
respecto al segundo grupo si bien tendremos una relación presencial, en su mayor parte del tiempo será virtual, debido a que ellos siempre estarán haciendo pedidos según sus indicaciones medicas o de salud.- aquí estaremos muy atentos a los post que nos envíen y comentarios de nuestros productos en redes sociales para ir mejorando día a día.
para el tercer grupo que son nuestros emporios y cafeteritas con ellos la relación será virtual ya que los pedidos serán online y las entregas solo de un par de minutos de manera presencial y no siempre podremos ir nosotros ya que de acuerdo a la demanda enviaremos a alguien que contratemos para la empresa y realice estos servicios de dlivery son cobrar por este servicio adicional a ellos, no obstante el feed back lo haremos online.",7.0
12366400.0,18.0,614457.0,"el vecinal : una relación cercana, amistosa 
el virtual : ya que no se tendrá mucho interacción física , se tratara se construir una relación de amistad lo que llevara a dar promociones y ofertas y descuentos a nuestros clientes circunferenciales como son amigos de facebook",7.0
11749640.0,18.0,641666.0,"la relación  con cada uno de los segmentos de clientes , sera personalizada.
al ser un negocio principalmente de atención presencial,  el cliente podrá  presentar sus inquietudes , problemas con productos o felicitaciones, donde tendrán una respuesta rápida , en caso de ocurrir algún inconveniente, este se solucionará de la forma mas expedita posible  . se aceptaran propuestas que ayuden a mejorar el negocio, y nuevas necesidades para la comunidad , las cuales se consideraran para implementar nuevos productos y así fidelizar a nuestros clientes.",3.0
12509040.0,18.0,693784.0,"la relación seria indirecta y directa con el servicio ya que por publicidad llegan a nosotros y se presta el servicio y se cobra un adicional al conductor para continuar teniendo clientes. el costo de la manera directa es alto ya que debe ser apalancado por el puertas a puerta y desarrollado con promotoras que realicen este anuncio , asimismo el costo de publicaciones en periódico es la mas costosa, la menos costosa es la de redes sociales y medios digitales.",3.0
6787330.0,18.0,1772136.0,"fidealizar al cliente presencial a través de mini muestras y mini regalitos en el mes de su cumpleaños.
al cliente de redes sociales a través de saludos de cumpleaños y mensajes de motivación.",3.0
7051550.0,18.0,1198976.0,"con el segmento de los estudiantes es fundamental establecer una relación directa y personalizada ya que es crucial que conozcan nuestros servicios y que por sobre todo los padres comprendan nuestros procedimientos internos que permiten a los alumnos disfrutar de un lugar seguro, tranquilo y libre de riesgos, el costo de este tipo de relación involucra principalmente una inversión de tiempo, una inversión que contempla una rentabilidad favorable.  
con el segmento dos y tres se establece inicialmente una relación virtual, en donde es fundamental la rapidez en los tiempos de respuesta que se expresan en nuestra famepage, puesto que de esta manera muchas veces se toma la decisión de reserva, dando respuestas oportunas, claras y precisas, puesto que es primordial a la hora de generar una reserva, sin embargo posterior a la reserva a la llegada de nuestros turistas,  nuestros procedimientos establecen que la relación debe ser presencial, personalizada y de confianza a fin de cumplir o superar las expectativas de nuestros clientes.
",7.0
14550350.0,18.0,1802588.0,"si bien la relación es automática ya que el cliente realizara la compra en un sitio web, este debe tener habilitada la opción de un chat para aclarar dudas y sugerencias de las opciones de servicio adicionales. luego sería una relación personalizada para ver qué resultado quiere para su regalo, si sólo será la compra de un producto con despacho, si quiere un envoltorio simple, pero con un saludo especial o bien si quiere un envoltorio lúdico con un saludo especial.
para el principal segmento “mujeres 30 – 50 años”
se pedirá opiniones con la que recogeremos su experiencia y sugerencias para mejorar día a día. 
generar base de datos con fechas de cumpleaños para enviar saludo y promociones.
usuarias frecuentes de sito web
se fidelizará con la entrega de un llavero de la tienda con lo que sorprenderemos al cliente y será un recordatorio de la página
además, un servicio de post venta, para verificar que todo se haya entregado de acuerdo a lo solicitado y también para que nos puedan retroalimentar de la experiencia vivida.  
entrega por delivery el cual será costo del cliente.
",5.0
5496230.0,18.0,1651294.0,"jefes/as de hogar: se mantendrá una relación personal directa e individualizada, los clientes serán atendidos con amabilidad y se ofrecerá un servicio de post venta que genere un vinculo de confianza en ellos. para ello se requiere contar con plan de minutos e internet para responder consultas y dudas pre y post venta. vehículo para traslado a entregar realizar el trabajo.
dueños de pequeños negocios: la relación con este grupo será de manera directa personal y presencial, tendré un trato cordial y cercano ofreceré atención pre y post venta, para ello cuento con un vehículo para trasladarme donde ellos y además de mantener plan de minutos e internet en caso que requieran cotización a sus correos electrónicos.
personas ambientalistas: con este segmento de clientes tendré una relación cercana, un trato cordial, amable y de compartir el mismo objetivo de ayudar en algo aunque sea mínimo el daño ambiental. para ello contar con redes sociales es fundamental.",7.0
14992520.0,18.0,1514674.0,"nuestro negocio está interesado en crear relaciones a largo plazo con todos los tipos de segmentos de clientes descritos: 
la relación con el segmento de clientes particulares es de forma personalizada, manteniendo constantemente información de productos, precios y promociones; ofrecer a nuestra clientela posibilidad de encargar y reservar productos; se aplican encuestas de satisfacción, consulta de preferencias y mejoras en la atención o el formato de la mercadería con el fin de cumplir con la satisfacción del cliente. 
respecto al segmento de clientes de pymes la relación es personal y como proveedor, con visitas a sus negocios, cumplimiento al 100% con sus pedidos en volumen y tiempo, se aplican encuestas de satisfacción y preferencias. ",7.0
12129550.0,18.0,575794.0,"la venta de terrenos mayores a 1 hectárea no siempre son negocios simples, por el contrario, son negociaciones que a veces toman bastante tiempo. dado esto, por un lado se generará una relación personal con interesados en comprar propiedades, la cual requerirá de construir una relación de confianza que permita un trabajo en conjunto de largo plazo.
por otro lado, al funcionar también como una vitrina para publicantes, también se generará una relación más automática por ejemplo con corredoras de propiedades que quieran publicar todos los terrenos que tengan en sus carteras.",1.0
12389030.0,18.0,669542.0,"espero propiciar que la relación sea cercana de manera de conocer sus gustos, preferencias y necesidades, así le podré ofrecer diferentes productos y precios, además puedo darles facilidades de pago y hasta hacer trueques, la idea es que pueda obtener sus teléfonos y mails con los que pueda ofrecerles algunas promociones por wathsapp y liquidaciones de temporada o por cambio de materiales y modelos, saludarlos por sus cumpleaños. independiente de esto siempre hay que mover las paginas de internet y redes sociales para estar presente y ser una posibilidad o acceso a los clientes virtuales, sortear algunos productos entre ellos o hacer ofertas 2 x 1.",5.0
4271540.0,18.0,365183.0,"- en los negocios de ventas de joyas la relación de comunicación es personal y directa; cara a cara, o vía telefónica. realizándose visitas en sus negocios y luego manteniéndose una comunicación cercana.
- relación a distancia a través de comunicación por e-mail.
- en el caso del cliente particular la relación y contacto con la empresa es principalmente indirecta a través de redes sociales. exceptuando cuando el particular se acerca a el showroom o tienda establecida.",7.0
